id,year,title,publicationname,citedbycount,asia,oceania,europe,north_america,south_america,africa,keywords_list,cluster,keyword_category
321,2021,TRANSIENT PARADOXICAL WORSENING OF VISION DUE TO GRAVITATIONAL SHIFT OF SUBRETINAL FLUID AFTER PHOTODYNAMIC THERAPY FOR CENTRAL SEROUS CHORIORETINOPATHY,Retinal Cases and Brief Reports,0,2,0,0,1,0,0,"['central serous chorioretinopathy', 'gravitational shift', 'half-dose', 'half-fluence', 'photodynamic therapy', 'subretinal fluid', 'verteporfin']",1,Medical and Technological Advances
322,2021,Outcomes and Prognostic Factors in Patients with Malignant Peripheral Nerve Sheath Tumor,Siriraj Medical Journal,0,3,0,0,0,0,0,"['Malignant peripheral nerve sheath tumor', 'MPNST', 'outcomes', 'prognostic factors', 'survival']",4,Public Health and Epidemiology
323,2021,"Critical care management of pulmonary arterial hypertension in pregnancy: The pre-, peri: The postpartum stages",Acute and Critical Care,6,4,0,0,0,0,0,"['Extracorporeal membrane oxygenation', 'Heart decompensation', 'Pregnancy', 'Pulmonary arterial hypertension', 'Right-sided heart failure', 'Vasodilator agents']",1,Medical and Technological Advances
324,2021,Management of post cholecystectomy bile duct injury: Pertinent factors contributing to good surgical outcomes,Journal of the Medical Association of Thailand,0,3,0,0,0,0,0,"['Bile duct injury', 'Cholecystectomy', 'Surgical management']",1,Medical and Technological Advances
325,2021,Integrating telemedicine in assisting poison center service: Line application,Journal of the Medical Association of Thailand,0,3,0,0,0,0,0,"['Application', 'Line', 'Poison center', 'Telemedicine']",1,Medical and Technological Advances
326,2021,The Use of SGLT2i and GLP-1 RA in patients with type 2 diabetes in thailand: Evidence review and recommendations,Journal of the Medical Association of Thailand,0,6,0,0,0,0,0,"['Cardiovascular diseases', 'Chronic kidney disease', 'Clinical outcomes', 'GLP-1 RA', 'SGLT2i', 'Type 2 diabetes mellitus']",1,Medical and Technological Advances
327,2021,Impact of vitamin d and calcium supplementation on bone mineral density and bone metabolism among thai adolescents with perinatally acquired human immunodeficiency virus (hiv) infection: A randomized clinical trial,Clinical Infectious Diseases,7,9,0,0,0,0,0,"['Bone mass', 'Bone turnover', 'Calcium', 'HIV-infected youth', 'Vitamin D']",1,Medical and Technological Advances
328,2021,Association of air pollution and meteorological variables with the two waves of COVID-19 pandemic in Delhi: A critical analysis,Heliyon,3,2,0,0,0,0,0,"['Air quality', 'COVID-19 successive waves', 'Environmental variables', 'Infection spreading trajectory', 'Reproduction rate']",1,Medical and Technological Advances
329,2021,Adaptability of siamese rosewood and teak seedlings to varying light conditions,Environment and Natural Resources Journal,2,2,0,0,0,0,0,"['Chlorophyll efficiency', 'Relative growth rate', 'Shade and sunlight', 'Siamese Rosewood', 'Teak']",1,Medical and Technological Advances
330,2021,Experimental study on the out-of-plane behavior of brick masonry walls strengthened with mortar and wire mesh: A pioneer study,Infrastructures,4,6,0,1,0,0,1,"['Bricks', 'Cement', 'Clay', 'Energy absorption', 'Flexural capacity', 'Masonry walls', 'Mortar', 'Strengthening', 'Wire mesh']",1,Medical and Technological Advances
331,2021,"Alkyne-tagged apigenin, a chemical tool to navigate potential targets of flavonoid anti-dengue leads",Molecules,4,6,0,0,0,0,0,"['Alkyne-azide cycloaddition', 'Alkyne-tagged flavonoid', 'Dengue virus', 'Drug discovery', 'Fla-vone', 'Target identification']",1,Medical and Technological Advances
332,2021,Multiple and high-risk clones of extended-spectrum cephalosporin-resistant and blandm-5-harbouring uropathogenic escherichia coli from cats and dogs in thailand,Antibiotics,9,5,0,0,0,0,0,"['BlaCTX-M', 'Carbapenemase', 'Clones', 'Pet', 'Uropathogenic Escherichia coli']",1,Medical and Technological Advances
333,2021,Sustainable fuel production from steam reforming of waste motor oil over olivine-supported Fe catalyst,Energy Reports,4,3,0,0,0,0,0,"['Fe catalyst', 'Olivine', 'Steam reforming', 'Syngas', 'Waste motor oil']",1,Medical and Technological Advances
334,2021,"Density, viscosity, physical CO2 diffusivity, and CO2 absorption capacity of novel blended N-methyl-4-piperidinol and piperazine solvent",Energy Reports,3,5,0,0,1,0,0,"['Absorption', 'Amine', 'Carbon capture', 'CO2', 'Novel solvent']",1,Medical and Technological Advances
335,2021,The role of in vitro detection of drug-specific mediator-releasing cells to diagnose different phenotypes of severe cutaneous adverse reactions,"Allergy, Asthma and Immunology Research",5,12,0,0,0,0,0,"['Cytokine', 'Diagnosis', 'Drug allergy', 'IFN-γ', 'In vitro', 'T cell']",1,Medical and Technological Advances
336,2021,Leaky gut syndrome is associated with endotoxemia and serum (1→3)-β-d-glucan in severe dengue infection,Microorganisms,11,7,0,0,0,0,0,"['Dengue', 'Endotoxins', 'Intestinal permeability', 'Lactulose-to-mannitol excretion ratio', 'Leaky gut', 'β-D-glucan']",1,Medical and Technological Advances
337,2021,"Catalytic performance of Co, Fe on MCM-41 synthesized from illite waste for gasification of torrefied cassava rhizome",Energy Reports,8,2,0,0,0,0,0,"['Cassava rhizome', 'Cobalt loaded', 'Illite', 'Iron loaded', 'Torrefaction']",1,Medical and Technological Advances
338,2021,Emergence of Dirofilaria repens (Spirurida: Onchocercidae) in dogs in Eastern Thailand,Veterinary World,1,3,0,0,0,0,0,"['Dirofilaria repens', 'Dog', 'Emerging', 'Prevalence', 'Thailand', 'Zoonosis']",1,Medical and Technological Advances
339,2021,Aromatic and aliphatic production of catalytic pyrolysis of lignin using ZSM-5/Al-SBA-15 catalyst derived from high-calcium fly ash,Energy Reports,12,2,0,0,0,0,0,"['Hydrocarbons', 'Kraft lignin', 'Phenolic compounds', 'SBA-15', 'ZSM-5']",1,Medical and Technological Advances
340,2021,Standardized the natural gas data for Thailand's sustainable goal,Energy Reports,0,2,0,0,0,0,0,"['Energy balance', 'Natural gas', 'Supply chain', 'Thailand', 'TIEB']",1,Medical and Technological Advances
341,2021,Selective aromatic production from fast pyrolysis of sugarcane bagasse lignin over ZSM-5 catalyst,Energy Reports,6,2,0,0,0,0,0,"['Aromatic', 'Fast pyrolysis', 'Lignin', 'Organosolv process', 'Sugarcane bagasse', 'ZSM-5']",1,Medical and Technological Advances
342,2021,"Adaptation of a theory-based social networking and gamified app-based intervention to improve pre-exposure prophylaxis adherence among young men who have sex with men in bangkok, thailand: Qualitative study",Journal of Medical Internet Research,1,4,0,0,3,0,0,"['Adherence', 'Mobile health', 'Mobile phone', 'Pre-exposure prophylaxis', 'Young men who have sex with men']",1,Medical and Technological Advances
343,2021,Cardiac surgery associated aki prevention strategies and medical treatment for csa-aki,Journal of Clinical Medicine,12,3,0,4,0,0,0,"['Acute kidney injury (AKI)', 'Cardiac surgery', 'Cardiac surgery associated AKI', 'Cardiovascular', 'Management', 'Prevention', 'Renal']",1,Medical and Technological Advances
344,2021,"Effective connectivity between major nodes of the limbic system, salience and frontoparietal networks differentiates schizophrenia and mood disorders from healthy controls",Journal of Personalized Medicine,10,1,0,1,0,0,0,"['Depression', 'Effective connectivity', 'Mood disorders', 'Psychiatry', 'Salience network', 'Schizophrenia']",1,Medical and Technological Advances
345,2021,Repurposing of high-dose erythropoietin as a potential drug attenuates sepsis in preconditioning renal injury,Cells,15,3,0,0,0,0,0,"['Cecal ligation and puncture', 'Erythropoietin', 'LPS', 'Macrophages', 'Mortality rate', 'Sepsis']",1,Medical and Technological Advances
346,2021,Particle engineering of chitosan and kaolin composite as a novel tablet excipient by nanoparticles formation and co-processing,Pharmaceutics,0,2,0,0,0,0,0,"['Chitosan', 'Co-processing', 'Kaolin', 'Nanoparticles', 'Spray drying']",1,Medical and Technological Advances
347,2021,Immersion vaccination by a biomimetic-mucoadhesive nanovaccine induces humoral immune response of red tilapia (Oreochromis sp.) against flavobacterium columnare challenge,Vaccines,14,7,0,1,0,0,0,"['Columnaris disease', 'Nano-immersion vaccine', 'Red tilapia', 'Systemic immune response']",1,Medical and Technological Advances
348,2021,"New drug targets to prevent death due to stroke: A review based on results of protein-protein interaction network, enrichment, and annotation analyses",International Journal of Molecular Sciences,6,3,1,4,0,1,0,"['Coagulation', 'Cytokines', 'Hemostasis', 'Inflammation', 'Neuroimmune', 'Protein-protein interactions', 'Stroke']",1,Medical and Technological Advances
349,2021,How do independent directors view generalist vs. specialist CEOs? Evidence from an exogenous regulatory shock,International Review of Financial Analysis,7,3,1,0,1,0,0,"['Board independence', 'Corporate governance', 'Generalist CEOs', 'Independent directors', 'Sarbanes-Oxley', 'Specialist CEOs']",1,Medical and Technological Advances
350,2021,Cytotoxic and anti-inflammatory activities of dihydroisocoumarin and xanthone derivatives from garcinia picrorhiza,Molecules,3,4,0,1,0,0,0,"['Anti-inflammatory', 'Clusiaceae', 'Cytotoxic', 'Garcinia picrorhiza', 'Isocoumarin', 'Xanthone']",1,Medical and Technological Advances
351,2021,The impact of csr on sustainable innovation ambidexterity: The mediating role of sustainable supply chain management and second-order social capital,Sustainability (Switzerland),20,3,0,0,0,0,0,"['Corporate social responsibility (CSR)', 'Mediation', 'Second-order social capital (SOSC)', 'Smart PLS', 'Sustainable innovation ambidexterity (SIA)', 'Sustainable supply chain management (SSCM)']",1,Medical and Technological Advances
352,2021,Titania nanotube architectures synthesized on 3d-printed ti-6al-4v implant and assessing vancomycin release protocols,Materials,5,5,0,0,0,0,0,"['3D printing', 'Electrostatic interaction', 'Ti-6Al-4V', 'Titania nanotubes', 'Vancomycin']",1,Medical and Technological Advances
353,2021,"Yield, grain quality, and starch physicochemical properties of 2 elite thai rice cultivars grown under varying production systems and soil characteristics",Foods,5,5,0,0,0,0,0,"['Grain quality', 'Production system', 'Rice (Oryza sativa L.)', 'Soil characteristic', 'Starch physicochemical properties']",1,Medical and Technological Advances
354,2021,"Wear resistance, color stability and displacement resistance of milled peek crowns compared to zirconia crowns under stimulated chewing and high-performance aging",Polymers,24,5,0,0,0,0,0,"['Aging process', 'Biodegradation', 'Biomaterials', 'CAD/CAM', 'Chewing simulation', 'Color stability', 'Crowns', 'Dental materials', 'Dentistry', 'Displacement resistance', 'PEEK', 'Wear resistance', 'Zirconia']",1,Medical and Technological Advances
355,2021,Hydroquinone 5-o-cinnamoyl ester of renieramycin m suppresses lung cancer stem cells by targeting akt and destabilizes c-myc,Pharmaceuticals,7,7,0,0,0,0,0,"['Akt', 'C-Myc', 'Cancer stem cell', 'Lung cancer', 'MTOR', 'Nanog', 'Oct4', 'Renieramycin M', 'Sox2']",1,Medical and Technological Advances
356,2021,Establishment of human-induced pluripotent stem cell-derived neurons—a promising in vitro model for a molecular study of rabies virus and host interaction,International Journal of Molecular Sciences,4,9,0,0,0,0,0,"['Human-induced pluripotent stem cells', 'In vitro model', 'Neurons', 'Proteomics analysis', 'Rabies virus', 'Virus–host interaction']",1,Medical and Technological Advances
357,2021,Pongol methyl ether inhibits akt and suppresses cancer stem cell phenotypes in lung cancer cells,Pharmaceuticals,2,8,0,0,0,0,0,"['Akt', 'Cancer stem cell', 'CSC-targeting', 'Lung cancer', 'Pongol methyl ether']",1,Medical and Technological Advances
358,2021,Hiv-1 protease and reverse transcriptase inhibitory activities of curcuma aeruginosa roxb. Rhizome extracts and the phytochemical profile analysis: In vitro and in silico screening,Pharmaceuticals,6,3,0,0,0,0,0,"['ADMET analysis', 'AIDS', 'Curcuma aeruginosa Roxb', 'Drug discovery', 'HIV-1 protease inhibitor', 'HIV-1 reverse transcriptase inhibitor', 'Immunodeficiency virus', 'Virtual screening']",1,Medical and Technological Advances
359,2021,Novelties in fuscosporellaceae (Fuscosporellales): Two new parafuscosporella from thailand revealed by morphology and phylogenetic analyses,Diversity,11,4,0,0,0,0,0,"['Phylogeny', 'Sordariomycetes', 'Systematics', 'Taxonomy', 'Two novel freshwater microfungi']",1,Medical and Technological Advances
360,2021,Industrial buyer innovation adoption model: A focus on a smartphone-based electrochemical analytical device for toxic heavy metal detection,Sustainability (Switzerland),2,4,0,0,0,0,0,"['Industrial consumer behavior', 'Industrial contaminants', 'Innovation adoption model', 'Portable electrochemical analytical devices', 'Predicting technology adoption']",1,Medical and Technological Advances
361,2021,Monocyte-to-lymphocyte ratio as a predictor of TB among people living with HIV,International Journal of Tuberculosis and Lung Disease,7,3,0,2,0,0,0,"['HIV', 'ML ratio', 'Monocytes', 'Predictor', 'Tuberculosis']",1,Medical and Technological Advances
362,2021,Transition metal atom doped Ni3S2 as efficient bifunctional electrocatalysts for overall water splitting: Design strategy from DFT studies,Molecular Catalysis,11,2,0,0,0,0,0,"['Bifunctional electrocatalysts', 'DFT study', 'Ni3S2', 'Overall water splitting']",1,Medical and Technological Advances
363,2021,Improved brønsted to lewis (B/L) ratio of co-and mo-impregnated ZSM-5 catalysts for palm oil conversion to hydrocarbon-rich biofuels,Catalysts,3,3,0,0,0,0,0,"['Biofuels', 'Brønsted–Lewis acid sites', 'Catalytic cracking', 'Co-Mo/ZSM-5', 'Hydrocarbon', 'Palm oil']",1,Medical and Technological Advances
364,2021,A comprehensive review of hla and severe cutaneous adverse drug reactions: Implication for clinical pharmacogenomics and precision medicine,Pharmaceuticals,18,10,0,1,0,0,0,"['HLA genetic polymorphisms', 'Human leukocyte antigen', 'Pharmacogenomics', 'Precision medicine', 'SCARs']",1,Medical and Technological Advances
365,2021,First episode psychosis and schizophrenia are systemic neuro-immune disorders triggered by a biotic stimulus in individuals with reduced immune regulation and neuroprotection,Cells,13,3,1,1,0,2,0,"['Bacterial translocation', 'Inflammation', 'LPS', 'Neuro-immune', 'Physiological stress', 'Psychiatry', 'Schizophrenia']",1,Medical and Technological Advances
366,2021,Pre-analytical modification of serum mirnas: Diagnostic reliability of serum mirnas in hemolytic diseases,Journal of Clinical Medicine,1,8,0,0,0,0,0,"['Blood drawing', 'Hemolytic disease', 'MicroRNA', 'MiR-451a', 'Pre-analytical', 'Serum separation']",1,Medical and Technological Advances
367,2021,Improved mixed-integer linear programming model for short-term scheduling of the pressing process in multi-layer printed circuit board manufacturing,Mathematics,2,2,0,0,0,0,0,"['Mixed-integer linear programming', 'Pressing process', 'Printed circuit board', 'Scheduling']",1,Medical and Technological Advances
368,2021,Overexpression of lipa or glpd_rubisco in the synechocystis sp. Pcc 6803 mutant lacking the aas gene enhances free fatty-acid secretion and intracellular lipid accumulation,International Journal of Molecular Sciences,3,1,0,1,0,0,0,"['Acyl-ACP synthetase', 'FFA secretion', 'Lipase A', 'Membrane lipid degradation', 'Synechocystis sp. PCC 6803']",1,Medical and Technological Advances
369,2021,Interference on cytosolic DNA activation attenuates sepsis severity: Experiments on cyclic GMP–AMP synthase (cGAS) deficient mice,International Journal of Molecular Sciences,16,7,0,0,0,0,0,"['Cecal ligation and puncture', 'Cell free DNA', 'CGAS', 'LPS', 'Sepsis']",1,Medical and Technological Advances
370,2021,"Spatial variation of cladophora epiphytes in the Nan River, Thailand",Plants,2,1,0,0,1,0,0,"['Cladophora', 'Ecological services', 'Lotic environment', 'Microbiome', 'Nan River']",1,Medical and Technological Advances
371,2021,Thunbergia laurifolia leaf extract inhibits glutamate-induced neurotoxicity and cell death through mitophagy signaling,Antioxidants,6,5,0,0,0,0,0,"['Autophagy', 'Glutamate', 'Mitophagy', 'Neurodegenerative diseases', 'Oxidative stress', 'Thunber-gia laurifolia']",1,Medical and Technological Advances
372,2021,TiO2/MXene-PVA/GO hydrogel-based electrochemical sensor for neurological disorder screening via urinary norepinephrine detection,Microchimica Acta,15,3,0,0,0,0,0,"['Electrochemical sensor', 'Neurological disorder', 'TiO2/MXene-PVA/GO hydrogel', 'Urinary norepinephrine', 'Voltammetry']",1,Medical and Technological Advances
373,2021,Exploring the impact of flavonoids on symptoms of depression: A systematic review and meta-analysis,Antioxidants,14,1,0,1,0,0,0,"['Antioxidants', 'Depression', 'Diet', 'Flavonoids', 'Mental health', 'Oxidative stress']",1,Medical and Technological Advances
374,2021,Different responses of soil respiration to environmental factors across forest stages in a Southeast Asian forest,Ecology and Evolution,11,10,0,1,0,0,0,"['forest succession', 'soil moisture', 'soil organic matter', 'soil respiration', 'soil temperature', 'tropical forests']",1,Medical and Technological Advances
375,2021,Development of cellulose from recycled office waste paper-based composite as a platform for the colorimetric sensor in food spoilage indicator,Journal of Polymer Research,4,2,0,0,0,0,0,"['Cellulose based composite', 'Colorimetric sensor', 'Food spoilage detection', 'Office waste paper']",1,Medical and Technological Advances
376,2021,Immunogenicity of 2-dose pre-exposure rabies vaccine co-administered with quadrivalent influenza vaccine in children,International Journal of Infectious Diseases,1,4,0,0,0,0,0,"['Children', 'Inactivated quadrivalent influenza vaccine', 'Pre-exposure rabies prophylaxis', 'Rabies vaccine']",1,Medical and Technological Advances
377,2021,The role of once-weekly online hemodiafiltration with low protein diet for initiation of renal replacement therapy: A case series,International Journal of Artificial Organs,0,3,0,0,0,0,0,"['hemodiafiltration', 'Incremental hemodialysis', 'low-protein diet', 'once-weekly dialysis']",1,Medical and Technological Advances
378,2021,Antitubercular and antibacterial activities of isoxazolines derived from natural products: Isoxazolines as inhibitors of Mycobacterium tuberculosis InhA,Journal of Chemical Research,6,7,0,0,0,0,0,"['1', '3-dipolar cycloaddition', 'antibacterial activity', 'antitubercular activity', 'InhA inhibitor', 'isoxazoline derivatives', 'Mycobacterium tuberculosis']",3,Materials Science and Taxonomy
379,2021,Optimization of elemental recovery from electronic wastes using a mild oxidizer,Waste Management,5,3,0,0,0,0,0,"['Electrochemical process', 'Electronic waste', 'Metal recovery', 'Mild oxidizer', 'Rare-earth element']",1,Medical and Technological Advances
380,2021,"National culture and saving: How collectivism, uncertainty avoidance, and future orientation play roles",Global Finance Journal,4,3,0,0,0,0,0,"['Collectivism', 'Culture', 'Future orientation', 'Saving', 'Uncertainty avoidance']",1,Medical and Technological Advances
381,2021,Facile preparation protocol of magnetic mesoporous carbon acid catalysts via soft-template self-assembly method and their applications in conversion of xylose into furfural,"Philosophical Transactions of the Royal Society A: Mathematical, Physical and Engineering Sciences",3,6,0,0,0,0,0,"['acid catalyst', 'furfural', 'magnetic', 'mesoporous carbon', 'soft-template self-assembly', 'xylose']",2,Cell Biology and Biochemistry
382,2021,Reduced ELANE and SLPI expression compromises dental pulp cell activity,Cell Proliferation,2,7,0,0,0,0,0,"['cytokines', 'inflammation', 'neutropenia', 'neutrophil elastase', 'periodontitis', 'protease']",2,Cell Biology and Biochemistry
383,2021,"The economic history of Thailand: Old debates, recent advances, and future prospects",Australian Economic History Review,0,2,0,0,0,0,0,"['agriculture', 'development', 'economic history', 'Thailand', 'wages']",4,Public Health and Epidemiology
384,2021,Flexible cotton-AuNP thread electrode for non-enzymatic sensor of uric acid in urine,Cellulose,6,3,0,0,0,0,0,"['Cotton thread', 'Flexible electrode', 'Gold nanoparticle', 'Non-enzymatic sensor', 'Uric acid']",1,Medical and Technological Advances
385,2021,Solution-mediated transformation of natural zeolite to ANA and CAN topological structures with altered active sites for ethanol conversion,Advanced Powder Technology,3,3,1,0,0,0,0,"['Acetaldehyde production', 'Analcime zeolite', 'Cancrinite zeolite', 'Ethanol conversion', 'Natural mordenite zeolite']",1,Medical and Technological Advances
386,2021,Dose calculation accuracy in particle therapy: Comparing carbon ions with protons,Medical Physics,5,1,0,3,0,0,0,"['carbon ions', 'dose calculation algorithms', 'heterogeneous phantom', 'protons']",2,Cell Biology and Biochemistry
387,2021,Analysis of flocculation in a jet clarifier. Part 2 - Analysis of aggregate size distribution versus Camp number,Chemical Engineering Research and Design,1,3,0,2,0,0,0,"['Camp number Gt', 'Floc size distribution', 'Image analysis', 'Jet clarifier', 'Velocity gradient']",1,Medical and Technological Advances
388,2021,Incidence / predictors of pediatric obstructive sleep apnea with normal oximetry,Pediatrics International,2,4,0,0,1,0,0,"['adenotonsillar hypertrophy', 'nocturnal oximetry', 'obstructive sleep apnea']",1,Medical and Technological Advances
389,2021,Overall survival with warfarin vs. low-molecular-weight heparin in cancer-associated thrombosis,Journal of Thrombosis and Haemostasis,7,1,0,0,4,0,0,"['anticoagulation', 'cancer-associated thrombosis', 'low-molecular-weight heparin', 'venous thromboembolism', 'warfarin']",2,Cell Biology and Biochemistry
390,2021,Analysis of flocculation in a jet clarifier. Part 1 – Global and local hydrodynamic analysis,Chemical Engineering Research and Design,1,1,0,2,0,0,0,"['Hydrodynamics', 'Jet clarifier', 'Particle image velocimetry', 'Velocity gradient']",1,Medical and Technological Advances
391,2021,Vertical Vibration of Multiple Flexible Strip Foundations on Multilayered Transversely Isotropic Poroelastic Soils,International Journal of Geomechanics,7,2,0,0,1,0,0,"['Dynamic structure-soil-structure interaction', 'Fourier integral transform', 'Layered media', 'Stiffness matrix method', 'Transverse isotropy', 'Variational methods']",1,Medical and Technological Advances
392,2021,Clinical and pathological attributes of hepatocellular carcinoma showing lack of restricted diffusion on magnetic resonance imaging,Journal of Health Science and Medical Research,0,3,0,1,1,0,0,"['Diffuse weighted imaging', 'Hepatocellular carcinoma', 'Histological grading', 'Liver', 'Non-restricted diffusion']",1,Medical and Technological Advances
393,2021,A study of the tp53 germline mutation and clinicopathologic features in thai children with adrenocortical carcinoma,Journal of Health Science and Medical Research,0,4,0,0,0,0,0,"['Adrenocortical carcinoma', 'Children', 'Germline mutation', 'Hereditary', 'Li-Fraumeni syndrome', 'TP53']",1,Medical and Technological Advances
394,2021,Annealing dependent synthesis of cyto-compatible nano-silver/calcium hydroxyapatite composite for antimicrobial activities,Arabian Journal of Chemistry,19,6,0,1,0,0,2,"['Antibacterial activity', 'Anticancer studies', 'Brine shrimp assay', 'Hydroxyapatite', 'Synthetic urine', 'Ureolytic Bacillus sp.']",1,Medical and Technological Advances
395,2021,Molecular and functional insights into glutathione S-transferase genes associated with salt stress in Halothece sp. PCC7418,Plant Cell and Environment,9,4,0,0,0,0,0,"['cyanobacteria', 'gene expression', 'oxidative stress']",2,Cell Biology and Biochemistry
396,2021,Identification of in vivo expressed proteins in live attenuated lipopolysaccharide mutant that mediates heterologous protection against Leptospira spp,Veterinary Microbiology,1,6,3,0,0,0,0,"['Cross-protection', 'In vivo induced genes', 'Leptospirosis', 'Live attenuated vaccine']",1,Medical and Technological Advances
397,2021,Failure Analysis of Dapped-End Cracking in Posttensioned Bridge Girder,Journal of Bridge Engineering,7,5,0,0,0,0,0,"['Bridge girders', 'Cracks', 'Dapped-end', 'Finite-element analysis', 'Prestressed concrete']",1,Medical and Technological Advances
398,2021,"Streptomyces endocoffeicus sp. nov., an endophytic actinomycete isolated from Coffea arabica (L.)","Antonie van Leeuwenhoek, International Journal of General and Molecular Microbiology",1,6,0,0,0,0,0,"['16S rRNA gene', 'Coffea arabica L', 'Endophytic actinobacterium', 'Streptomyces']",1,Medical and Technological Advances
399,2021,Relationship between microstructure and performances of simultaneous biaxially stretched films based on thermoplastic starch and biodegradable polyesters,International Journal of Biological Macromolecules,16,3,0,0,0,0,0,"['Biaxially stretched film', 'Biodegradable polyesters', 'Thermoplastic starch']",1,Medical and Technological Advances
400,2021,Paper-based sensor from pyrrolidinyl peptide nucleic acid for the efficient detection of Bacillus cereus,Analytical and Bioanalytical Chemistry,5,5,0,0,0,0,0,"['Bacillus cereus', 'Carboxymethylcellulose', 'Foodborne pathogens', 'Paper-based sensor', 'Peptide nucleic acid']",1,Medical and Technological Advances
401,2021,Prevalence and Impact of Obesity on Disease-specific Outcomes in a Population-based Cohort of Patients with Ulcerative Colitis,Journal of Crohn's and Colitis,9,1,0,0,2,0,0,"['inflammatory bowel disease [IBD]', 'obesity', 'Ulcerative colitis[UC]']",0,Sustainability and Diversity
