id,year,title,publicationname,citedbycount,asia,oceania,europe,north_america,south_america,africa,keywords_list,cluster,keyword_category
243,2021,Metabolic syndrome in Thai adolescents and associated factors: the Thai National Health Examination Survey V (NHES V),BMC Public Health,8,7,0,0,0,0,0,"['Adolescents', 'Metabolic syndrome', 'Prevalence', 'Risk factors']",1,Medical and Technological Advances
244,2021,Difficult airway predictors were associated with decreased use of neuromuscular blocking agents in emergency airway management: a retrospective cohort study in Thailand,BMC Emergency Medicine,1,4,0,0,0,0,0,"['Airway management', 'Difficult airway', 'Emergency department', 'Emergency medicine', 'Rapid sequence induction and intubation']",1,Medical and Technological Advances
245,2021,Economic burden of non-alcoholic steatohepatitis with significant fibrosis in Thailand,BMC Gastroenterology,9,5,0,0,1,0,0,"['Cost of illness', 'Economic burden', 'NASH', 'Non-alcoholic steatohepatitis', 'Prevalence', 'Significant fibrosis', 'Thailand']",1,Medical and Technological Advances
246,2021,A fundamental exploration on carbon nanotube formation via pyrolysis of ferrocene and glycerol: Experimental and theoretical viewpoints,"Engineering Science and Technology, an International Journal",2,3,0,0,0,0,0,"['CNT', 'Co-pyrolysis', 'Kinetics', 'Mathematical model', 'Thermodynamics']",1,Medical and Technological Advances
247,2021,"MBTPS2, a membrane bound protease, underlying several distinct skin and bone disorders",Journal of Translational Medicine,9,3,0,0,0,0,0,"['BRESHECK', 'IFAP', 'KFSD', 'Olmsted syndrome', 'Osteogenesis imperfecta', 'S2P']",1,Medical and Technological Advances
248,2021,System dynamics modelling of health workforce planning to address future challenges of Thailand’s Universal Health Coverage,Human Resources for Health,8,7,0,1,0,0,0,"['Care delivery models', 'Causal loop diagram', 'Group model building', 'Health systems performance', 'Health workforce', 'Human resource for health', 'Strategic planning', 'System dynamic modelling']",1,Medical and Technological Advances
249,2021,"Antitumor activities of Aspiletrein A, a steroidal saponin from Aspidistra letreae, on non-small cell lung cancer cells",BMC Complementary Medicine and Therapies,7,5,0,0,0,0,0,"['Anti-invasion', 'Anti-migration', 'Anti-proliferation', 'Aspidistra letreae', 'Aspiletrein A', 'Lung cancer cells']",1,Medical and Technological Advances
250,2021,Detection of SARS-CoV-2-specific antibodies via rapid diagnostic immunoassays in COVID-19 patients,Virology Journal,13,3,0,0,0,0,0,"['Antibody', 'COVID-19', 'Immunoassay', 'Rapid diagnostic test', 'SARS-CoV-2']",1,Medical and Technological Advances
251,2021,Protective role of Clitoria ternatea L. flower extract on methylglyoxal-induced protein glycation and oxidative damage to DNA,BMC Complementary Medicine and Therapies,5,3,0,0,0,0,0,"['Anthocyanins', 'Clitoria ternatea', 'Methylglyoxal', 'Oxidative DNA damage', 'Protein glycation']",1,Medical and Technological Advances
252,2021,Measurement of gene amplifications related to drug resistance in Plasmodium falciparum using droplet digital PCR,Malaria Journal,2,4,0,1,0,0,0,"['ddPCR', 'pfgch1', 'pfmdr1', 'pfplasmepsin2', 'Plasmodium falciparum']",1,Medical and Technological Advances
253,2021,Pullout Capacity Factor for Cylindrical Suction Caissons in Anisotropic Clays Based on Anisotropic Undrained Shear Failure Criterion,Transportation Infrastructure Geotechnology,29,2,0,0,0,0,0,"['Anisotropic clays', 'Axisymmetry', 'Finite element limit analysis', 'Suction caisson', 'Undrained shear strengths']",1,Medical and Technological Advances
254,2021,Further addition to the braconid fauna of Iran (Hymenoptera: Braconidae),Egyptian Journal of Biological Pest Control,13,2,0,0,0,0,1,"['Braconidae', 'Entomological collections', 'New records', 'Subfamilies']",1,Medical and Technological Advances
255,2021,Undrained Stability of Unsupported Conical Slopes in Anisotropic Clays Based on Anisotropic Undrained Shear Failure Criterion,Transportation Infrastructure Geotechnology,48,2,0,0,0,0,0,"['Anisotropic clays', 'Conical slope', ' finite element limit analysis', 'Stability', 'Undrained shear strengths']",1,Medical and Technological Advances
256,2021,The Patient’s Denture Assessment (Thai version) is a valid and reliable tool for evaluating the outcome of treatment with complete denture,BMC Oral Health,0,2,0,0,0,0,0,"['Complete denture', 'PDA-T', 'Reliability and validity', 'Satisfaction', 'Self-assessment']",1,Medical and Technological Advances
257,2021,Usefulness of an accelerometer-based navigation system in bilateral one-stage total knee arthroplasty,BMC Musculoskeletal Disorders,7,2,0,0,1,0,0,"['Accelerometer-based navigation', 'Bilateral total knee arthroplasty', 'Blood loss', 'Mechanical axis', 'Postoperative pain']",1,Medical and Technological Advances
258,2021,Diagnostic Value of Interleukin-34 as a Novel Biomarker for Severity of Knee Osteoarthritis,Cartilage,3,3,0,0,0,0,0,"['biomarker', 'interleukin-34', 'knee osteoarthritis', 'synovial inflammation']",2,Cell Biology and Biochemistry
259,2021,Immunoglobulin G1 subclass responses can be used to detect specific allergy to the house dust mites Dermatophagoides farinae and Dermatophagoides pteronyssinus in atopic dogs,BMC Veterinary Research,0,6,0,0,0,0,0,"['Antibody', 'Biomarker', 'Canine atopic dermatitis', 'House dust mites', 'Immunoglobulin G1 subclass']",1,Medical and Technological Advances
260,2021,Fruit ripening-associated leucylaminopeptidase with cysteinylglycine dipeptidase activity from durian suggests its involvement in glutathione recycling,BMC Plant Biology,6,2,0,0,0,0,0,"['Cys-Gly', 'Durian', 'Fruit ripening', 'LAP', 'Leucylaminopeptidase', 'Sulphur compound']",1,Medical and Technological Advances
261,2021,Clearance of inflammatory cytokines in patients with septic acute kidney injury during renal replacement therapy using the EMiC2 filter (Clic-AKI study),Critical Care,13,2,0,3,0,0,0,"['Acute kidney injury', 'CRRT', 'EMiC2 filter', 'Extracorporeal blood purification', 'High cut-off', 'Kidney replacement therapy', 'Middle cut-off', 'Removal', 'Sepsis']",1,Medical and Technological Advances
262,2021,Multi-factorial considerations for intra-thoracic lymph node evaluations of healthy cats on computed tomographic images,BMC Veterinary Research,3,2,0,0,0,0,0,"['Cat', 'Computed tomography', 'Lymph node', 'Slice thickness', 'Thorax', 'Thymus']",1,Medical and Technological Advances
263,2021,"Synthesis, X-Ray Crystallography, Theoretical Investigation and Optical Properties of 2-Chloro-N-(2,4-dinitrophenyl) Acetamide",Journal of Chemical Crystallography,0,6,0,0,1,0,0,"['2', '4-Dinitroaniline derivative', 'Crystal structure', 'Hydrogen bonding interactions']",3,Materials Science and Taxonomy
264,2021,A cadaveric study of the location and morphology of the central patellar ridge for bone-patellar tendon-bone graft,Journal of Orthopaedic Surgery and Research,0,2,0,0,0,0,0,"['ACL reconstruction', 'Bone-patellar tendon-bone', 'Patellar fracture', 'Patellar morphology', 'Wiberg’s classification']",1,Medical and Technological Advances
265,2021,Molecular docking studies of some selected gallic acid derivatives against five non-structural proteins of novel coronavirus,Journal of Genetic Engineering and Biotechnology,26,3,0,0,0,0,3,"['Binding energy', 'Druglikeness', 'Gallic acid derivatives', 'In silico', 'Molecular docking', 'Molecular interactions', 'Non-structural proteins', 'Novel coronavirus', 'SARS-COV-2']",1,Medical and Technological Advances
266,2021,Protein-bound uremic toxin lowering strategies in chronic kidney disease: a systematic review and meta-analysis,Journal of Nephrology,15,2,0,0,0,0,0,"['Chronic kidney disease', 'Indoxyl sulfate', 'p-Cresyl sulfate', 'Protein-bound uremic toxins']",1,Medical and Technological Advances
267,2021,Pattern of cortical thinning in logopenic progressive aphasia patients in Thailand,BMC Neurology,1,3,0,0,0,0,0,"['Alzheimer’s disease', 'Aphasia', ' primary progressive', 'Cortical thickness', 'Freesurfer', 'Logopenic progressive aphasia', 'Magnetic resonance imaging']",1,Medical and Technological Advances
268,2021,Salbutamol-induced lactic acidosis in status asthmaticus survivor,BMC Pulmonary Medicine,3,3,0,0,0,0,0,"['Case report', 'Lactic acidosis', 'Salbutamol-induced lactic acidosis', 'Salbutamol’s adverse effect', 'Status asthmaticus']",1,Medical and Technological Advances
269,2021,Convergence analysis of gradient-based iterative algorithms for a class of rectangular Sylvester matrix equations based on Banach contraction principle,Advances in Difference Equations,7,2,0,0,0,0,0,"['Banach contraction principle', 'Generalized Sylvester matrix equation', 'Gradient', 'Kronecker product', 'Linear difference vector equation', 'Matrix norms']",1,Medical and Technological Advances
270,2021,Molecular characterization of G6PD mutations reveals the high frequency of G6PD Aures in the Lao Theung population,Malaria Journal,9,4,0,0,0,0,0,"['G6PD Aures', 'G6PD deficiency', 'G6PD genotype', 'G6PD mutation', 'Lao Theung', 'Laos']",1,Medical and Technological Advances
271,2021,Application of artificial intelligence in chronic liver diseases: a systematic review and meta-analysis,BMC Gastroenterology,33,4,0,0,0,0,0,"['Artificial intelligence', 'Cirrhosis', 'Computer-assisted', 'Deep learning', 'Fatty liver', 'Liver fibrosis', 'Liver steatosis', 'Machine learning', 'NAFLD', 'Non-invasive diagnostic tests']",1,Medical and Technological Advances
272,2021,The effects of a limited infusion rate of fluid in the early resuscitation of sepsis on glycocalyx shedding measured by plasma syndecan-1: a randomized controlled trial,Journal of Intensive Care,9,6,0,0,0,0,0,"['Emergency department', 'Endothelial glycocalyx', 'Fluid', 'Resuscitation', 'Sepsis', 'Syndecan-1']",1,Medical and Technological Advances
273,2021,Biosynthetic sericin 1-like protein skews dendritic cells to tolerogenic-like phenotype,Biotechnology and Applied Biochemistry,2,6,0,0,0,0,0,"['biosynthetic sericin 1', 'sericin', 'tolerogenic dendritic cells']",1,Medical and Technological Advances
274,2021,Therapeutic plasma exchange vs conventional treatment with intravenous high dose steroid for neuromyelitis optica spectrum disorders (NMOSD): a systematic review and meta-analysis,Journal of Neurology,17,3,0,0,1,0,0,"['Meta-analysis', 'Neuromyelitis optica', 'NMOSD', 'Optic neuritis', 'Plasma exchange', 'Steroid']",1,Medical and Technological Advances
275,2021,Clusterin Is Associated with Systemic and Synovial Inflammation in Knee Osteoarthritis,Cartilage,9,3,0,0,0,0,0,"['apolipoprotein J', 'biomarker', 'clusterin', 'knee osteoarthritis', 'synovial inflammation']",2,Cell Biology and Biochemistry
276,2021,The clinical significance of antinuclear antibodies and specific autoantibodies in juvenile and adult systemic lupus erythematosus patients,Asian Pacific Journal of Allergy and Immunology,6,4,0,4,0,0,0,"['anti-double stranded DNA', 'antinuclear antibodies', 'autoantibodies', 'autoimmune diseases', 'systemic lupus erythematosus']",2,Cell Biology and Biochemistry
277,2021,Response surface optimization of biodiesel synthesis over a novel biochar-based heterogeneous catalyst from cultivated (Musa sapientum) banana peels,Biomass Conversion and Biorefinery,10,6,0,0,0,0,0,"['Biodiesel', 'Cultivated banana peels', 'Heterogeneous catalyst', 'Response surface methodology (RSM)', 'Transesterification']",1,Medical and Technological Advances
278,2021,Taxonomic reassessment of large mammals from the Pleistocene Homo-bearing site of Tham Wiman Nakin (Northeast Thailand): relevance for faunal patterns in mainland Southeast Asia,Quaternary International,6,2,0,2,0,0,0,"['Ailuropoda-Stegodon fauna', 'Biochronology', 'Chaiyaphum province', 'Extinction', 'Quaternary', 'Taxonomy']",1,Medical and Technological Advances
279,2021,Multicentre cohort study of cochlear implantation outcomes in Thailand,BMJ Open,3,10,0,0,0,0,0,"['cochlear implant', 'cochlear implantation', 'deafness', 'hearing loss', 'registry', 'report']",4,Public Health and Epidemiology
280,2021,Cloud-Based Smart Energy Framework for Accelerated Data Analytics with Parallel Computing of Orchestrated Containers: Study Case of CU-BEMS,ACM International Conference Proceeding Series,0,2,0,0,0,0,0,"['Data Analytics', 'Kubernetes', 'Parallel Computing', 'Smart Energy Framework']",1,Medical and Technological Advances
281,2021,Barrier performance and biodegradability of antibacterial poly(butylene adipate-co-terephthalate) nanocomposites reinforced with a new MWCNT-ZnO nanomaterial,Nanotechnology,18,9,0,0,0,0,0,"['antibacterial', 'barrier performance', 'biodegradability', 'mechanical behavior', 'MWCNT-ZnO', 'nanocomposites', 'poly(butylene adipate-co-terephthalate)']",2,Cell Biology and Biochemistry
282,2021,Determining the role of oxygen vacancies in palmitone selectivity and coke formation over acid metal oxide catalysts for the ketonization of methyl palmitate,Applied Catalysis A: General,5,3,0,0,0,0,0,"['Catalyst deactivation', 'Hydrogen trapping', 'Ketonization', 'Liquid phase', 'Long-chain methyl ester', 'Oxygen vacancies']",1,Medical and Technological Advances
283,2021,A durable rechargeable zinc-air battery via self-supported MnOx-S air electrode,Journal of Alloys and Compounds,22,6,0,0,0,0,0,"['Bifunctional catalyst', 'Manganese oxide', 'Oxygen evolution', 'Oxygen reduction', 'Stability', 'Sulfurization']",1,Medical and Technological Advances
284,2021,Responsiveness to incentives in organ donation decisions: A laboratory experiment,Thammasat Review,0,2,0,0,0,0,0,"['Experimental economics', 'Organ allocation rule', 'Organ donation']",1,Medical and Technological Advances
285,2021,A Polystyrene Foam Factory Fire in a Bangkok Satellite City: Incident and Lessons Learned,ACS Chemical Health and Safety,2,3,0,0,0,0,0,"['chemical industry', 'disaster risk management cycle', 'emergency response', 'explosion', 'fire', 'styrene', 'Thailand']",4,Public Health and Epidemiology
286,2021,An origami paper-based peptide nucleic acid device coupled with label-free DNAzyme probe hybridization chain reaction for prostate cancer molecular screening test,Analytica Chimica Acta,8,3,0,0,0,0,0,"['G-quadruplex', 'Hybridization chain reaction', 'Molecular screening test', 'Paper-based analytical device', 'Peptide nucleic acid', 'Prostate cancer']",1,Medical and Technological Advances
287,2021,Effect of magnetic fields on the efficiency of the photocatalytic degradation of methylene blue in a dynamic fluid system,Journal of Cleaner Production,5,2,0,0,0,0,0,"['Dynamic fluid', 'Magnetic fields', 'Methylene blue', 'Photocatalytic degradation', 'Ultraviolet irradiation', 'Zinc oxide catalyst']",1,Medical and Technological Advances
288,2021,Improved stability of zeolitic imidazolate framework-8 photocatalytic coating on polyurethane foam via polyelectrolyte multilayer surface modification,Colloids and Surfaces A: Physicochemical and Engineering Aspects,2,3,0,0,0,0,0,"['Layer-by-layer deposition', 'Photocatalyst', 'Polyurethane foam', 'ZIF-8']",1,Medical and Technological Advances
289,2021,Interactions between natural organic matter fractions and nanoscale zero-valent iron,Science of the Total Environment,8,3,0,0,1,0,0,"['Fractionation', 'Groundwater', 'Nanoscale zero-valent iron', 'Natural organic matter', 'Reactivity', 'Suwannee River']",1,Medical and Technological Advances
290,2021,Rate of Cornea Endothelial Cell Loss and Biomechanical Properties in Fuchs' Endothelial Corneal Dystrophy,Frontiers in Medicine,2,2,0,0,0,0,0,"['corneal biomechanics', 'corneal endothelial cell loss', 'corvis', 'FECD', ""fuchs' endothelial dystrophy""]",2,Cell Biology and Biochemistry
291,2021,Preferential and persistent impact of acute HIV-1 infection on CD4+ iNKT cells in colonic mucosa,Proceedings of the National Academy of Sciences of the United States of America,1,4,0,2,5,0,0,"['ART', 'Gut', 'HIV-1', 'Immune activation', 'INKT cells']",1,Medical and Technological Advances
292,2021,Kinetic study of selected microorganisms and quality attributes during cold storage of mango and passion fruit smoothie subjected to dimethyl dicarbonate,International Journal of Food Microbiology,4,1,0,0,1,0,0,"['Cold storage', 'Dimethyl dicarbonate', 'Kinetic model', 'Pathogenic microorganism', 'Physicochemical properties', 'Smoothie']",1,Medical and Technological Advances
293,2021,"Histological and ultrastructural characterization of the gonads of the grunting toadfish allenbatrachus grunniens (Linnaeus, 1758) from the pranburi river estuary, Thailand",Trends in Sciences,1,5,0,0,1,0,0,"['Batrachoididae', 'Histology', 'Oocytes', 'Reproductive cycle', 'Sperm', 'Thailand']",1,Medical and Technological Advances
294,2021,Mechanical performance and optimization of high-volume fly ash concrete containing plastic wastes and graphene nanoplatelets using response surface methodology,Construction and Building Materials,50,3,0,0,0,0,0,"['Graphene nanoplatelets', 'High-volume fly ash', 'HVFA concrete', 'Plastic waste', 'Response surface methodology']",1,Medical and Technological Advances
295,2021,"Development of reactive iron-coated natural filter media for treating antibiotic residual in swine wastewater: Mechanisms, intermediates and toxicity",Journal of Environmental Management,6,6,0,0,0,0,0,"['Antibiotic', 'Degradation pathway', 'Heterogeneous fenton-like reaction', 'Iron-coated catalyst', 'Swine wastewater', 'Toxicity test']",1,Medical and Technological Advances
296,2021,Pyrolysis of sewage sludge for sustainable biofuels and value-added biochar production,Journal of Environmental Management,34,8,0,1,0,0,0,"['Bio-oil', 'Biochar', 'Kinetic modeling', 'Pyrolysis', 'Pyrolysis gas', 'Sewage sludge']",1,Medical and Technological Advances
297,2021,Characterization of nilpotent Lie algebras of breadth 3 over finite fields of odd characteristic,Journal of Algebra,4,3,0,0,0,0,0,"['Breadth', 'Finite fields', 'Nilpotent Lie algebras']",1,Medical and Technological Advances
298,2021,A biorefinery approach for high value-added bioproduct (astaxanthin) from alga Haematococcus sp. and residue pyrolysis for biochar synthesis and metallic iron production from hematite (Fe2O3),Fuel,5,7,0,1,0,0,0,"['Biochar', 'Microalgae Haematococcus lacustris', 'Natural astaxanthin', 'Pyrolysis', 'Thermogravimetric analysis (TGA)']",1,Medical and Technological Advances
299,2021,Variation of the mangrove sediment microbiomes and their phenanthrene biodegradation rates during the dry and wet seasons,Environmental Pollution,12,4,0,0,0,0,0,"['Biodegradation rate', 'Mangrove sediment', 'Phenanthrene', 'Phenanthrene-degrading bacteria', 'Seasonal effect']",1,Medical and Technological Advances
300,2021,Performance of CaO catalyst prepared from magnetic-derived CaCO3 for biodiesel production,Fuel,21,2,0,0,0,0,0,"['Aragonite/calcite ratio', 'Biodiesel production', 'Calcium oxide', 'Magnetic fields', 'Quantitative analysis', 'Solid catalyst']",1,Medical and Technological Advances
301,2021,Resistome characterization of Flavobacterium columnare isolated from freshwater cultured Asian sea bass (Lates calcarifer) revealed diversity of quinolone resistance associated genes,Aquaculture,3,4,0,0,0,0,0,"['Antimicrobial resistance', 'Asian sea bass', 'Flavobacterium columnare', 'Quinolones', 'Resistome']",1,Medical and Technological Advances
302,2021,"The Feasibility of Ultrasonographic Diaphragmatic Excursion in Healthy Dogs: Effect of Positioning, Diaphragmatic Location, and Body Weight of Dogs",Frontiers in Veterinary Science,0,2,0,0,0,0,0,"['canine', 'diaphragm', 'movement', 'normal', 'ultrasound']",0,Sustainability and Diversity
303,2021,"Barrier Island Sediments Reveal Storm Surge and Fluvial Flood Events in the Past Centuries at Thua Thien Hue, Central Vietnam",Frontiers in Ecology and Evolution,2,4,0,1,0,0,0,"['barrier island', 'fluvial flood deposit', 'OSL dating', 'storm deposit', 'Vietnam']",1,Medical and Technological Advances
304,2021,Simultaneous production of hydrogen and carbon nanotubes from biogas: On the effect of Ce addition to CoMo/MgO catalyst,International Journal of Hydrogen Energy,8,6,0,0,0,0,0,"['Biogas', 'Carbon nanotubes', 'Ce addition', 'CO2 methanation', 'CVD', 'Hydrogen']",1,Medical and Technological Advances
305,2021,Short Practical Regimen of Acupuncture for Melasma: A Prospective Cohort Study in a Tertiary Hospital in Thailand,Frontiers in Public Health,0,3,0,0,1,0,0,"['acupuncture–therapy', 'dose–response', 'melasma', 'melasma area and severity index', 'Thailand']",1,Medical and Technological Advances
306,2021,Genetic diversity of blue-spotted mudskipper (Boleophthalmus boddarti) populations in Gulf of Thailand,Agriculture and Natural Resources,1,3,0,1,0,0,0,"['Blue-spotted mudskipper', 'Control region', 'Gene flow', 'Genetic diversity', 'Gulf of Thailand']",1,Medical and Technological Advances
307,2021,"A Systematic Review and Meta-analysis of Randomized Controlled Trials of United States Food and Drug Administration-Approved, Home-use, Low-Level Light/Laser Therapy Devices for Pattern Hair Loss: Device Design and Technology",Journal of Clinical and Aesthetic Dermatology,3,4,0,0,0,0,0,"['androgenetic alopecia', 'FDA-approved LLLT devices', 'hair loss', 'low-level laser therapy', 'low-level light therapy', 'Pattern hair loss']",1,Medical and Technological Advances
308,2021,Effects of water temperature rise on energy budget allocation in Pacific white shrimp (Litopenaeus vannamei),Songklanakarin Journal of Science and Technology,0,4,0,0,0,0,0,"['energy expenditure', 'global warming', 'growth performance', 'oxygen consumption', 'thermal stress']",1,Medical and Technological Advances
309,2021,Structural and morphological characterization of Thai monazite ore processing samples,Songklanakarin Journal of Science and Technology,0,3,0,0,0,0,0,"['characterization', 'monazite ore processing', 'morphological', 'rare earth element', 'structural']",4,Public Health and Epidemiology
310,2021,Identification of highly potent α-glucosidase inhibitors from Garcinia schomburgkiana and molecular docking studies,Songklanakarin Journal of Science and Technology,0,7,0,0,0,0,0,"['Clusiaceae', 'Garcinia schomburgkiana', 'molecular docking calculation', 'α-glucosidase inhibition']",1,Medical and Technological Advances
311,2021,Genetic variation of Boesenbergia rotunda (L.) Mansf. from Thailand based on essential oil compositions and internal transcribed spacer sequences,Songklanakarin Journal of Science and Technology,1,4,0,0,0,0,0,"['Boesenbergia rotunda', 'essential oil', 'genetic variation', 'ITS sequences']",1,Medical and Technological Advances
312,2021,Numerical simulations on potential application of ground source heat pumps with vertical ground heat exchangers in Bangkok and Hanoi,Energy Reports,7,10,0,0,0,0,0,"['Ground source heat pump', 'Southeast Asia', 'Space cooling', 'Thermal response test']",1,Medical and Technological Advances
313,2021,Local inflammatory mediators alterations induced by Daboia siamensis venom,Toxicon: X,0,2,0,0,0,0,0,"['Cyclooxygenase', 'Daboia siamensis venom', 'Eicosanoids', 'Local inflammatory mediators']",1,Medical and Technological Advances
314,2021,Catalytic behavior of La2O3-promoted SO42− /ZrO2 in the simultaneous esterification and transesterification of palm oil,Energy Reports,9,3,0,0,0,0,0,"['Biodiesel', 'La2O3', 'Simultaneous esterification and transesterification', 'SO42−/ZrO2', 'Solid catalyst']",1,Medical and Technological Advances
315,2021,Proportion and Factors Associated with Anxiety in Women with Abnormal Cervical Cancer Screening at King Chulalongkorn Memorial Hospital,Thai Journal of Obstetrics and Gynaecology,0,2,0,0,0,0,0,"['Abnormal cervical cancer screening', 'Anxiety', 'Jalowiec coping scale', 'PAP smear', 'The spielberger state-trait anxiety inventory']",1,Medical and Technological Advances
316,2021,A new tool for quality control to monitor contamination of six non-halal meats in food industry by multiplex high-resolution melting analysis (HRMA),NFS Journal,2,5,0,0,0,0,0,"['Adulteration', 'Contamination', 'Halal food', 'Multiplex HRMA', 'Non-halal meat', 'Quality control']",1,Medical and Technological Advances
317,2021,"Phytochemical Composition, Antioxidant and Antityrosinase Activities, and Quantification of (+)-Dihydrokaempferol of Different Parts of Manilkara zapota",Indian Journal of Pharmaceutical Sciences,3,3,0,0,0,0,0,"['Antioxidant', 'Antityrosinase activity', 'Dihydrokaempferol', 'High performance liquid chromatography', 'Manilkara zapota']",1,Medical and Technological Advances
318,2021,Comparison of the effect of hot and thermo-neutral environments on fat oxidation during post-exercise recovery in exercise-trained obese women: A preliminary report,Trends in Sciences,0,3,0,0,0,0,0,"['Environmental temperature', 'Fat oxidation', 'Indirect calorimetry', 'Moderate-intensity exercise training', 'Obesity', 'Post-exercise recovery']",1,Medical and Technological Advances
319,2021,"Novel clonality assays for T cell lymphoma in cats targeting the T cell receptor beta, T cell receptor delta, and T cell receptor gamma loci",Journal of Veterinary Internal Medicine,4,1,0,0,1,0,0,"['cat', 'clonality assay', 'hepatic small cell lymphoma', 'lymphoma', 'multiplex PCR', 'T cell receptor']",0,Sustainability and Diversity
320,2021,Clinical manifestations of early childhood dengue virus infection in Thailand,Medical Journal of Malaysia,1,3,0,0,0,0,0,"['Dengue infection', 'Early childhood', 'Morbidity', 'Mortality', 'Thailand']",1,Medical and Technological Advances
