id,year,title,publicationname,citedbycount,asia,oceania,europe,north_america,south_america,africa,keywords_list,cluster,keyword_category
163,2021,"Curcumin upregulates transforming growth factor-β1, its receptors, and vascular endothelial growth factor expressions in an in vitro human gingival fibroblast wound healing model",BMC Oral Health,9,3,0,0,0,0,0,"['Curcumin', 'Fibroblasts', 'Gingiva', 'Transforming growth factor beta', 'Vascular endothelial growth factor', 'Wound healing']",1,Medical and Technological Advances
164,2021,Strength and stiffness parameters for hardening soil model of rockfill materials,Soils and Foundations,13,4,0,0,0,0,0,"['Hardening Soil model', 'Particle breakage', 'Rockfill materials', 'Stress level dependency', 'Triaxial and Oedometer tests']",1,Medical and Technological Advances
165,2021,"Trachusa vietnamensis, a new species from Vietnam (Hymenoptera apoidea megachilidae)",Bulletin of Insectology,1,1,0,1,0,0,0,"['Anthophila', 'DNA barcode', 'Species description', 'Taxonomy', 'Wild bees']",1,Medical and Technological Advances
166,2021,Graphene oxide/doped polyindole/hydroxypropyl cellulose coated on interdigitated electrode as methanol sensor,Microchemical Journal,3,3,0,0,0,0,0,"['Chemical sensor', 'Conductive polymer', 'Graphene oxide', 'Hydroxypropyl cellulose', 'Interdigitated electrode', 'Polymer composite']",1,Medical and Technological Advances
167,2021,Corporate integrity and hostile takeover threats: Evidence from machine learning and “CEO luck”,Journal of Behavioral and Experimental Finance,16,4,0,0,1,0,0,"['Agency theory', 'Corporate governance', 'Hostile takeover', 'Integrity', 'Machine learning', 'Textual analysis']",1,Medical and Technological Advances
168,2021,Targets and strategies for vaccine development against dengue viruses,Biomedicine and Pharmacotherapy,7,6,0,0,0,0,0,"['Dengue vaccine', 'Dengue virus', 'DNA vaccine', 'Inactivated virus', 'Live-attenuated virus', 'Review', 'Subunit vaccine', 'Viral-vector vaccine']",1,Medical and Technological Advances
169,2021,"Indonesian Kaolin supported nZVI (IK-nZVI) used for the an efficient removal of Pb(II) from aqueous solutions: Kinetics, thermodynamics and mechanism",Journal of Environmental Chemical Engineering,19,7,0,0,0,0,0,"['Adsorption', 'IK-nVZI nanocomposite', 'Kinetics', 'Pb(II) ions removal', 'Thermodynamics']",1,Medical and Technological Advances
170,2021,Accurate determination of meat mass fractions using DNA measurements for quantifying meat adulteration by digital PCR,International Journal of Food Science and Technology,10,2,0,2,0,1,0,"['DNA measurements', 'droplet digital PCR', 'food mislabelling', 'mass fractions', 'meat quantification', 'pork/beef adulteration']",1,Medical and Technological Advances
171,2021,Development of the reverse hybrid jig: Separation of polyethylene and cross-linked polyethylene from eco-cable wire,Minerals Engineering,7,3,1,0,0,0,0,"['Jig', 'Plastic separation', 'Polyolefin', 'Recycling', 'Reverse hybrid jig']",1,Medical and Technological Advances
172,2021,A multi-objective modeling approach to harvesting resource scheduling: Decision support for a more sustainable Thai sugar industry,Computers and Industrial Engineering,4,2,0,1,1,0,0,"['Evolutionary algorithm', 'Harvesting resource scheduling', 'Multi-objective optimization problem', 'Particle swarm optimization', 'Sugarcane', 'Sustainability']",1,Medical and Technological Advances
173,2021,Colorimetric detection of Pb2+ ions using curcumin silver nanoparticles,Journal of Molecular Liquids,4,5,0,0,0,0,0,"['Biosynthesis', 'Colorimetric detection', 'Density functional theory', 'Silver nanoparticles', 'Turmeric extract']",1,Medical and Technological Advances
174,2021,Hydroxypropyl methylcellulose/microcrystalline cellulose biocomposite film incorporated with butterfly pea anthocyanin as a sustainable pH-responsive indicator for intelligent food-packaging applications,Food Bioscience,27,4,0,0,0,0,0,"['Anthocyanin', 'Butterfly pea', 'Freshness indicator', 'Intelligent packaging', 'Mackerel']",1,Medical and Technological Advances
175,2021,Factors associated with medication adherence of hypertensive patients in the Philippines: a systematic review,Clinical Hypertension,10,2,0,0,0,0,0,"['Hypertension', 'Medication adherence', 'Patient compliance', 'Pharmacy', 'Philippines']",1,Medical and Technological Advances
176,2021,Farnesoid X receptor agonist for the treatment of chronic hepatitis B: A safety study,Journal of Viral Hepatitis,12,1,0,7,0,0,0,"['cccDNA transcription', 'farnesoid X receptor', 'HBV therapy', 'phase Ib', 'Vonafexor']",1,Medical and Technological Advances
177,2021,Ablation versus medication as initial therapy for paroxysmal atrial fibrillation: An updated meta-analysis of randomized controlled trials,Journal of Arrhythmia,3,1,0,0,5,0,0,"['atrial fibrillation ablation', 'first-line therapy', 'paroxysmal atrial fibrillation']",1,Medical and Technological Advances
178,2021,Selective separation of trace nickel(II) and gold(I) ions via hollow fiber supported liquid membrane enhanced by synergistic extractants D2EHPA/TBP,Arabian Journal of Chemistry,5,2,0,0,0,0,0,"['Electroless nickel immersion gold plating', 'Gold(I)', 'Hollow fiber supported liquid membrane', 'Nickel(II)', 'Rinse wastewater']",1,Medical and Technological Advances
179,2021,Primary Versus Secondary Anaplastic Thyroid Carcinoma: Perspectives from Multi-institutional and Population-Level Data,Endocrine Pathology,3,8,0,0,2,0,0,"['Anaplastic', 'De novo', 'Primary', 'Secondary', 'Thyroid', 'Transformation', 'Undifferentiated']",1,Medical and Technological Advances
180,2021,Acceptance and outcome of interventions in a meropenem de-escalation antimicrobial stewardship program in pediatrics,Pediatrics International,3,5,0,0,0,0,0,"['acceptance', 'antimicrobial stewardship program (asp)', 'meropenem', 'pediatrics', 'prospective audit and feedback']",4,Public Health and Epidemiology
181,2021,Assessment and analysis of multi-biomass fuels for sustainable electricity generation,Renewable Energy,9,4,0,0,0,0,0,"['Biomass power plant', 'CO2 capture', 'Fluidized bed combustion', 'Multi-biomass fuels']",1,Medical and Technological Advances
182,2021,The Thai reference exome (T-REx) variant database,Clinical Genetics,15,14,0,0,0,0,0,"['database', 'genomic medicine', 'population genetics', 'precision medicine', 'rare disease', 'Thai']",4,Public Health and Epidemiology
183,2021,Smoking and Drinking Behaviors among Older Adults: A Comparative Analysis of Three Southeast Asian Countries,Journal of Cross-Cultural Gerontology,0,1,0,0,1,0,0,"['Correlates', 'Drinking', 'Older adults', 'Prevalence', 'Smoking', 'Southeast Asia']",1,Medical and Technological Advances
184,2021,Prevalence of complex root canal morphology in the mandibular first and second premolars in Thai population: CBCT analysis,BMC Oral Health,7,2,0,0,0,0,0,"['Bifurcation', 'C-shaped root canal', 'CBCT', 'Mandibular premolar', 'Thai population', 'Trifurcation']",1,Medical and Technological Advances
185,2021,Efficiencies of anaerobic hybrid and UASB reactors to alleviate the adverse effect of elevated salinity in wastewater,Journal of Chemical Technology and Biotechnology,1,5,0,0,0,0,0,"['anaerobic hybrid reactor', 'microbial activity', 'salinity', 'toxicity', 'upflow anaerobic sludge bed reactor']",0,Sustainability and Diversity
186,2021,Effect of ultrasound-guided selective sensory nerve blockade of the knee on pain management compared with periarticular injection for patients undergoing total knee arthroplasty: A prospective randomized controlled trial,Knee,5,2,0,0,0,0,0,"['Analgesia', 'Arthroplasty', 'Knee replacement', 'Nerve block', 'Pain management']",1,Medical and Technological Advances
187,2021,Dorsomorphin attenuates Jagged1-induced mineralization in human dental pulp cells,International Endodontic Journal,2,2,0,0,0,0,0,"['bone morphogenetic protein', 'dental pulp', 'Jagged1', 'notch signalling', 'transforming growth factor']",1,Medical and Technological Advances
188,2021,In-situ catalytic upgrading of bio-oil from rapid pyrolysis of biomass over hollow HZSM-5 with mesoporous shell,Bioresource Technology,17,5,0,0,0,0,0,"['Aromatic hydrocarbons selectivity', 'Bio-oil upgrading', 'Hollow HZSM-5', 'Mesoporous structure', 'Rapid pyrolysis']",1,Medical and Technological Advances
189,2021,Simulation of shear behavior of corroded reinforced concrete beams flexurally repaired with steel fiber-reinforced concrete,Structures,11,5,0,0,0,0,0,"['Corrosion', 'Finite element', 'Repair', 'Shear', 'Steel fiber reinforced concrete']",1,Medical and Technological Advances
190,2021,Vortex assisted dispersive liquid–liquid microextraction based on low transition temperature mixture solvent for the HPLC determination of pyrethroids in water samples: Experimental study and COSMO-RS,Microchemical Journal,5,5,0,0,0,0,0,"['Conductor-like screening model for realistic solvents (COSMO-RS)', 'DL-menthol', 'High-performance liquid chromatography (HPLC)', 'Liquid transition temperature mixture (LTTM)', 'Pyrethroids insecticides', 'Vortex assisted dispersive liquid–liquid microextraction (VADLLME)']",1,Medical and Technological Advances
191,2021,Efficacy of heat-killed and formalin-killed vaccines against Tilapia tilapinevirus in juvenile Nile tilapia (Oreochromis niloticus),Journal of Fish Diseases,19,8,0,2,0,0,0,"['immune responses', 'inactivated vaccine', 'Nile tilapia', 'protection', 'tilapia lake virus']",4,Public Health and Epidemiology
192,2021,"Comprehensive versus standard care in post-severe acute kidney injury survivors, a randomized controlled trial",Critical Care,13,9,0,0,0,0,0,"['AKI survivors', 'Comprehensive care', 'Critically ill patients', 'Post-acute kidney injury', 'Severe AKI']",1,Medical and Technological Advances
193,2021,Experimental study of the load-deformation behaviour of the precast post-tensioned continuous girder for straddle monorail: Full-scale load test under service and ultimate loading conditions,Case Studies in Construction Materials,6,4,0,0,0,0,0,"['Finite element analysis', 'Girder', 'Pier segments', 'Posttensioned', 'Precast concrete', 'Service load', 'Straddle monorail']",1,Medical and Technological Advances
194,2021,Melatonin and its derivative disrupt cancer stem-like phenotypes of lung cancer cells via AKT downregulation,Clinical and Experimental Pharmacology and Physiology,9,7,0,0,0,0,0,"['acetyl melatonin', 'AKT', 'cancer stem cells', 'lung cancer', 'melatonin']",2,Cell Biology and Biochemistry
195,2021,Predictors of knowledge and use of long-lasting insecticidal nets for the prevention of malaria among the pregnant women in Pakistan,Malaria Journal,1,3,0,0,0,0,0,"['Factors and healthcare workers', 'Long-lasting insecticidal nets', 'Malaria awareness/knowledge', 'Mosquito bite prevention', 'Pakistan', 'Predicator', 'Pregnancy']",1,Medical and Technological Advances
196,2021,Blood First Assay Screening Trial (BFAST) in Treatment-Naive Advanced or Metastatic NSCLC: Initial Results of the Phase 2 ALK-Positive Cohort,Journal of Thoracic Oncology,19,6,0,5,5,2,0,"['Alectinib', 'ALK-positive', 'Blood-based assay', 'Next-generation sequencing', 'NSCLC']",1,Medical and Technological Advances
197,2021,Nature of electronic topological transition and superconductivity in bismuth under high pressure from ab initio random structure searching,Computational Materials Science,5,5,0,0,0,0,0,"['Bismuth', 'Density functional theory', 'High pressure', 'Structure prediction', 'Superconductor']",1,Medical and Technological Advances
198,2021,Efficient conversion of acetate or glucose to poly(3-hydroxybutyrate) and glycogen by the single-stage photoheterotrophic cultivation of cyanobacterium Chroococcus hansgirgi TISTR 8561,Journal of Applied Phycology,1,2,0,0,0,0,0,"['Conversion', 'Cyanobacteria', 'Glycogen', 'Mixotrophy', 'Photoheterotrophy', 'Poly(3-hydroxybutyrate)']",1,Medical and Technological Advances
199,2021,The influences of granite industry waste on concrete properties with different strength grades,Case Studies in Construction Materials,10,2,0,0,0,0,0,"['Concrete materials', 'Granite particle', 'Mechanical strength', 'Microstructure', 'Recycled aggregate']",1,Medical and Technological Advances
200,2021,Increased C-reactive protein concentration and suicidal behavior in people with psychiatric disorders: A systematic review and meta-analysis,Acta Psychiatrica Scandinavica,21,1,2,5,3,0,0,"['C-reactive protein', 'inflammation', 'prevention', 'psychiatry', 'suicidal attempt', 'suicidal behavior', 'suicidal ideation', 'suicidality']",0,Sustainability and Diversity
201,2021,Modeling of void fraction and relative velocity covariance for dispersed bubbly and intermittent flows in horizontal channels,International Journal of Heat and Mass Transfer,0,2,0,0,0,0,0,"['Horizontal flow', 'Interfacial drag force', 'Relative velocity covariance', 'Two-phase flow', 'Void fraction covariance']",1,Medical and Technological Advances
202,2021,Strengthening effect of natural fiber reinforced polymer composites (NFRP) on concrete,Case Studies in Construction Materials,18,7,0,0,0,0,0,"['De-lamination', 'End anchorage', 'Epoxy resin', 'Polyester resin', 'Reinforced concrete beams', 'Sisal FRP', 'Strengthening']",1,Medical and Technological Advances
203,2021,Tenofovir alafenamide nephrotoxicity: a case report and literature review,AIDS Research and Therapy,3,7,0,0,0,0,0,"['Acute kidney injury', 'Antiretroviral therapy', 'Case report', 'HIV', 'Mitochondria', 'Nephrotoxicity', 'Renal pathology', 'Tenofovir alafenamide']",1,Medical and Technological Advances
204,2021,Detailed kinetic mechanism of devolatilization stage and CFD modeling of downdraft gasifiers using pelletized palm oil empty fruit bunches,Renewable Energy,5,2,0,0,1,0,0,"['Computational fluid dynamics', 'Downdraft biomass gasifier', 'Kinetic mechanism', 'Palm oil empty fruit bunch', 'Tar cracking']",1,Medical and Technological Advances
205,2021,"Stroke risk factors, subtypes and outcome in elderly Thai patients",BMC Neurology,5,2,0,0,0,0,0,"['Elderly', 'Outcomes', 'Risk factors', 'Stroke', 'Stroke classification', 'Thailand']",1,Medical and Technological Advances
206,2021,Structural predictions of superconducting phase in tungsten ditellurides WTe2 from first-principles evolutionary techniques under high pressure,Computational Materials Science,0,4,0,1,0,0,0,"['Density functional theory', 'High pressure', 'Structural prediction', 'Superconductivity', 'Tungsten ditellurides']",1,Medical and Technological Advances
207,2021,"Suicide attempts are associated with activated immune-inflammatory, nitro-oxidative, and neurotoxic pathways: A systematic review and meta-analysis",Journal of Affective Disorders,28,3,1,1,0,0,0,"['Depression', ' Mood disorders', ' Schizophrenia', ' Psychiatry', 'Inflammation', 'Neuro-immune', 'Oxidative and nitrosative stress', 'Suicide']",1,Medical and Technological Advances
208,2021,An automated fast-flow/delayed paper-based platform for the simultaneous electrochemical detection of hepatitis B virus and hepatitis C virus core antigen,Biosensors and Bioelectronics,31,6,0,0,0,0,0,"['Electrochemical detection', 'Hepatitis B surface antigen', 'Hepatitis B virus', 'Hepatitis C virus', 'Hepatitis C virus core antigen', 'Microfluidic paper-based analytical device']",1,Medical and Technological Advances
209,2021,Perioperative temperature management: a survey of 6 Asia–Pacific countries,BMC Anesthesiology,7,8,0,1,0,0,0,"['Asia', 'Health knowledge', ' attitudes', ' practice', 'Hypothermia', 'Monitoring', ' intraoperative', 'Perioperative care', 'Practice guidelines as topic', 'Temperature']",1,Medical and Technological Advances
210,2021,Distribution and genetic diversity of Enterovirus G (EV-G) on pig farms in Thailand,BMC Veterinary Research,4,2,0,0,0,0,0,"['Distribution', 'Diversity', 'Enterovirus G', 'Pigs', 'Thailand']",1,Medical and Technological Advances
211,2021,"Acute kidney injury prevalence, progression and long-term outcomes in critically ill patients with COVID-19: a cohort study",Annals of Intensive Care,28,2,0,2,0,0,0,"['Acute kidney injury', 'AKI', 'COVID-19', 'Dialysis', 'Kidney replacement therapy', 'Recovery', 'SARS-CoV-2']",1,Medical and Technological Advances
212,2021,Genetic polymorphism of the extracellular region in surface associated interspersed 1.1 gene of Plasmodium falciparum field isolates from Thailand,Malaria Journal,0,2,0,0,0,0,0,"['Gene polymorphism', 'Malaria', 'Plasmodium falciparum', 'Surf gene', 'SURFIN', 'Variable surface antigens']",1,Medical and Technological Advances
213,2021,Acute prolonged motor aura resembling ischemic stroke after COVID − 19 vaccination (CoronaVac): the first case report,Journal of Headache and Pain,9,7,0,0,0,0,0,"['CoronaVac vaccine', 'Cortical spreading depression', 'COVID-19', 'Neurological deficit', 'Sinovac']",1,Medical and Technological Advances
214,2021,Highly effective microwave plasma application for catalyst-free and low temperature hydrogenation of biodiesel,Fuel,7,5,0,0,1,0,0,"['Biodiesel', 'Microwave plasma', 'Palm oil', 'Partial hydrogenation', 'Partially hydrogenated fatty acid methyl ester']",1,Medical and Technological Advances
215,2021,Cisplatin-induced hydroxyl radicals mediate pro-survival autophagy in human lung cancer H460 cells,Biological Research,8,5,0,0,0,0,0,"['Autophagy', 'Cisplatin', 'Drug resistance', 'Hydroxyl radicals', 'Lung cancer']",1,Medical and Technological Advances
216,2021,Heat Integration Design of Alpha Methyl Ester Sulfonate Production Process,Process Integration and Optimization for Sustainability,1,2,0,0,0,0,0,"['Alpha methyl ester sulfonate', 'Aspen Energy Analyzer and Heat Exchanger Network', 'Heat integration', 'Simulation']",1,Medical and Technological Advances
217,2021,Renal 99mTc-DMSA pharmacokinetics in pediatric patients,EJNMMI Physics,4,1,0,0,5,0,0,"['Compartmental modeling', 'DMSA', 'Dose reduction/optimization', 'Pediatric imaging', 'Pharmacokinetics']",1,Medical and Technological Advances
218,2021,The evaluation of non-anesthetic computed tomography for detection of pulmonary parenchyma in feline mammary gland carcinoma: a preliminary study,BMC Veterinary Research,0,2,0,0,0,0,0,"['Atelectasis', 'Cat', 'Computed tomography', 'Lung', 'Mammary gland carcinoma', 'Radiography']",1,Medical and Technological Advances
219,2021,Surface analysis of dental caries using a wireless pH sensor and Raman spectroscopy for chairside diagnosis,Talanta,5,4,0,0,0,0,0,"['Chairside instrument', 'Dental caries', 'Iridium oxide', 'pH sensor', 'Wireless communication system']",1,Medical and Technological Advances
220,2021,Enhanced production of hydrocarbons from lignin isolated from sugarcane bagasse using formic acid induced supercritical ethanol liquefaction followed by hydrodeoxygenation,Chemosphere,5,3,0,0,0,0,0,"['Hydrocarbons', 'Hydrodeoxygenation', 'Hydrothermal liquefaction', 'Lignin', 'Lignin oil', 'Sugarcane bagasse']",1,Medical and Technological Advances
221,2021,Survival rate and associated factors affecting pulpectomy treatment outcome in primary teeth,Clinical and Experimental Dental Research,5,2,0,0,0,0,0,"['general anesthesia', 'primary teeth', 'pulpectomy', 'survival rate']",1,Medical and Technological Advances
222,2021,Expression of SOX2 and OCT4 in odontogenic cysts and tumors,Head and Face Medicine,1,2,0,0,0,0,0,"['Ameloblastic fibroma', 'Ameloblastoma', 'OCT4', 'Odontogenic Keratocyst', 'SOX2']",1,Medical and Technological Advances
223,2021,A novel method to treat recurrent facial pain: a case report,Journal of Medical Case Reports,0,2,0,0,0,0,0,"['Occlusal equilibration appliance (OEA)', 'Pain Posselt’s finding', 'Recurrent chronic facial pain']",1,Medical and Technological Advances
224,2021,Mindfulness and eudaimonic well-being: The mediating roles of rumination and emotion dysregulation,International Journal of Adolescent Medicine and Health,5,1,1,0,0,0,0,"['emotion dysregulation', 'eudaimonic well-being', 'mindfulness', 'rumination']",2,Cell Biology and Biochemistry
225,2021,"Impact of binding positions of 1,3-alternate calix[4]arene tetrabenzoic acids on geometry of coordination polymers",Journal of Inclusion Phenomena and Macrocyclic Chemistry,0,2,0,0,0,0,0,"['Advanced material', 'Calix[4]arene', 'Complexation', 'Coordination polymer', 'Crystal structure']",1,Medical and Technological Advances
226,2021,Prevalence of latent tuberculosis infection and feasibility of TB preventive therapy among Thai prisoners: a cross-sectional study,BMC Public Health,10,6,0,0,0,0,0,"['IGRA', 'Inmate', 'Isoniazid preventive therapy', 'LTBI', 'TST']",1,Medical and Technological Advances
227,2021,Necroptosis in biliary atresia of the liver,Medical Molecular Morphology,1,5,0,0,0,0,0,"['Biliary atresia', 'Cell death', 'Cholangiocytes', 'Congenital biliary dilation', 'Immunohistochemistry', 'Liver', 'Necroptosis', 'Phosphorylated mixed lineage kinase domain-like']",1,Medical and Technological Advances
228,2021,"Simplify product safety and quality risk analysis of raw materials for conventional, soilless culture and organic salads",Food Control,4,3,0,0,0,0,0,"['Conventional salad', 'Organic salad', 'Raw materials risk assessment', 'Soilless culture salad']",1,Medical and Technological Advances
229,2021,"Electric field analysis, polarization, excitation wavelength dependence, and novel applications of tip-enhanced Raman scattering",Journal of Raman Spectroscopy,3,7,0,0,0,0,0,"['electric field analysis', 'enantiomeric discrimination', 'graphene', 'tip-enhanced Raman scattering (TERS)']",2,Cell Biology and Biochemistry
230,2021,Starch extracted from pineapple (Ananas comosus) plant stem as a source for amino acids production,Chemical and Biological Technologies in Agriculture,7,2,0,0,0,0,0,"['Amino acids', 'Lysine', 'Methionine', 'Pineapple plant', 'Starch', 'Stem']",1,Medical and Technological Advances
231,2021,A novel gelatin/chitooligosaccharide/demineralized bone matrix composite scaffold and periosteum-derived mesenchymal stem cells for bone tissue engineering,Biomaterials Research,16,6,0,0,0,0,0,"['Chitooligosaccharide', 'Demineralized bone', 'Gelatin', 'Mesenchymal stem cells', 'Tissue engineering']",1,Medical and Technological Advances
232,2021,Pediatric patients’ reasons for visiting dentists in all WHO regions,Health and Quality of Life Outcomes,5,9,1,15,3,2,5,"['Child', 'Dentistry', 'Oral health', 'Oral health-related quality of life', 'Surveys and questionnaires', 'WHO']",1,Medical and Technological Advances
233,2021,Polythiocyanuric acid-functionalized MoS2 nanosheet-based high flux membranes for removal of toxic heavy metal ions and congo red,Chemical Engineering Journal,17,5,0,0,0,0,0,"['2D MoS2 nanosheets', 'Disulfides', 'Heavy metal ion removal', 'Membrane separation', 'PES membrane']",1,Medical and Technological Advances
234,2021,Multi-detector computed tomography (MDCT)–based severity score as a prognostic tool in patients with suspected immune checkpoint inhibitor therapy associated colitis,European Radiology,2,1,0,0,3,0,0,"['Colitis', 'Immune checkpoint inhibitors', 'Immunotherapy', 'Multi-detector computed tomography', 'Prognosis']",1,Medical and Technological Advances
235,2021,Targeting multiple genes containing long mononucleotide A-T repeats in lung cancer stem cells,Journal of Translational Medicine,1,7,0,0,0,0,0,"['Cancer stem cells', 'Hallmark of cancer', 'Lung cancer', 'Mononucleotide A-T repeats', 'Universal target']",1,Medical and Technological Advances
236,2021,"Ala97Ser transthyretin amyloidosis-associated polyneuropathy, clinical and neurophysiological profiles in a Thai cohort",BMC Neurology,6,4,0,0,0,0,0,"['Ala97Ser', 'autonomic neuropathy', 'carpal tunnel syndrome', 'composite autonomic severity score', 'hereditary transthyretin amyloidosis-associated polyneuropathy', 'neurophysiological study', 'quantitative sensory test', 'Thais', 'transthyretin']",2,Cell Biology and Biochemistry
237,2021,Reliability of a sequential ultrasound imaging technique (SUIT) to identify the individual elements of the brachial plexus above the clavicle,Regional Anesthesia and Pain Medicine,3,4,0,0,0,0,0,"['anesthesia', 'brachial plexus', 'conduction', 'regional anesthesia', 'ultrasonography']",2,Cell Biology and Biochemistry
238,2021,Rapid Degradation of Superabsorbent Poly(Potassium Acrylate) and its Acrylamide Copolymer Via Thermo-Oxidation by Hydrogen Peroxide,Journal of Polymers and the Environment,3,3,0,0,0,0,0,"['Hydrogen peroxide', 'Peroxidase', 'Phytotoxicity', 'Poly(potassium acrylate)', 'Poly[acrylamide-co-(potassium acrylate)]', 'Soil burial']",1,Medical and Technological Advances
239,2021,COVID-19 and HIV infection co-pandemics and their impact: a review of the literature,AIDS Research and Therapy,41,4,0,0,1,0,0,"['Clinical', 'Co-infection', 'COVID-19', 'HIV', 'Outcome', 'Pathophysiology']",1,Medical and Technological Advances
240,2021,Human dental pulp stem cell responses to different dental pulp capping materials,BMC Oral Health,19,8,0,0,0,0,0,"['Calcium hydroxide', 'Calcium silicate materials', 'Human dental pulp cells', 'Mineral trioxide aggregate', 'Pulp capping']",1,Medical and Technological Advances
241,2021,Loving local beans? The challenge of valorizing local food in the Thai highlands,"Environment, Development and Sustainability",1,2,0,0,0,0,0,"['Embeddedness', 'Local food', 'Rural development', 'Social practice', 'Valorization']",1,Medical and Technological Advances
242,2021,"Snail mucus from the mantle and foot of two land snails, Lissachatina fulica and Hemiplecta distincta, exhibits different protein profile and biological activity",BMC Research Notes,12,2,0,0,0,0,0,"['Anti-tyrosinase activity', 'Antimicrobial activity', 'Antioxidant activity', 'Land snail', 'Snail mucus']",1,Medical and Technological Advances
