Title,Source title,Cited by,Authors Country,Author Keywords,Year
"Molecular epidemiology and evolution of A(H1N1)pdm09 and H3N2 virus during winter 2012-2013 in Beijing, China","Infection, Genetics and Evolution",23,China,"A(H1N1)pdm09, H3N2, Molecular-genetic analysis, Phylogeny",2014
Protection against homo and hetero-subtypic inﬂuenza A virus by optimized M2e DNA vaccine,Emerging Microbes and Infections,11,China,"Influenza, M2e, optimized M2e DNA vaccine, tPA, Universal influenza vaccine",2019
A liquid chromatography tandem mass spectrometry method for a semiquantitative screening of cellular acyl-CoA,Analytical Biochemistry,3,United States,"Acyl-CoA, Liquid chromatography tandem mass spectrometry",2022
Is essential tremor a disorder of primary GABA dysfunction? Yes,International Review of Neurobiology,7,Spain,"Cerebellum, Essential tremor, GABA, Pathophysiology, Tremor",2022
"Synthesis and the selective antifungal activity of 5,6,7,8-tetrahydroimidazo[1,2-a]pyridine derivatives",European Journal of Medicinal Chemistry,55,United States,"Candida spp., Cytotoxicity, In vitro antifungal activity, Tetrahydroimidazo[1,2-a]pyridine",2010
A selective account of effective paradigms and significant outcomes in the discovery of inspirational marine natural products,Journal of Natural Products,58,United States,,2009
"One-Pot Synthesis of Hydroxy Pyrazolo[1,2-a][1,2,4]triazoles and Their Dehydration Using Recyclable Ionic Liquids as Reaction Media",Journal of Heterocyclic Chemistry,3,"India, Mali",,2018
"Highly efficient one-pot synthesis of 1-substituted-1,2,3,4- tetrahydropyrazino[1,2-a]indoles",Tetrahedron,35,India,"Benzotriazole, Frontier molecular orbital, Intramolecular cyclization, Lewis acid",2005
H1N1 Influenza A Virus Protein NS2 Inhibits Innate Immune Response by Targeting IRF7,Viruses,12,China,"influenza A virus, interferon, interferon regulatory factor 7, nonstructural protein 2",2022
TP003 is a non-selective benzodiazepine site agonist that induces anxiolysis via α2GABAA receptors,Neuropharmacology,8,"Switzerland, United States",,2018
"Beta-carboline as a promising heterocyclic nucleus: Synthetic aspects, pharmacological potential and structure activity relationship",European Journal of Medicinal Chemistry Reports,10,India,"Anti-HIV, Anti-trypanosomal, Anticancer, Antileishmanial, Antimalarial, Beta-carboline",2022
"Axial chirality and affinity at the GABAA receptor of pyrimido[1,2-a][1,4]benzodiazepines and related compounds",Bioorganic and Medicinal Chemistry,35,Japan,"Atropisomer, Estazolam, GABA<sub>A</sub> receptor, Pyrimido[1,2- a][1,4]benzodiazepine, Triazolam, X-ray analysis",2008
Detection of a new series of monoamine oxidase inhibitors,Chemical and Pharmaceutical Bulletin,9,Japan,"competitive inhibition, fluorometry, MAO inhibitor, nonselective inhibition, rat brain mitochondrial MAO, Tetra-P analogue",1985
"Isoindolo[2,1-a]quinoxaline derivatives, novel potent antitumor agents with dual inhibition of tubulin polymerization and topoisomerase I",Journal of Medicinal Chemistry,100,Italy,,2008
"p-TSA-promoted syntheses of 5H-benzo[h]thiazolo[2,3-b]quinazoline and indeno[1,2-d]thiazolo[3,2-a]pyrimidine analogs: Molecular modeling and in vitro antitumor activity against hepatocellular carcinoma","Drug Design, Development and Therapy",29,India,"ADMET, Caspases, Domino reactions, Dynamics, Hepatocellular carcinoma, Interleukins, Metal-free, Molecular docking, Multi-component reactions, Thiazolo[3,2-a]pyrimidine and thiazolo[2,3-b]quinazoline",2017
"Amantadine resistance among porcine H1N1, H1N2, and H3N2 influenza a viruses isolated in Germany between 1981 and 2001",Intervirology,42,Germany,"Amantadine resistance, Antivirals, Swine influenza",2006
Stereoselective metabolism of benzo[a]pyrene and 7-mthylbenzo[a]pyrene by liver microsomes from Sprague-Dawley rats pretreated with polychlorinated biphenyls,Chemico-Biological Interactions,13,United States,"7-Methylbenzo[a]pyrene, Benzo[a]pyrene, Polychlorinated biphenyls, Rat liver microsomes, Stereochemistry, Stereoselective metabolism",1983
Reducing amplification cycles to improve the coverage of influenza A virus genome sequencing in heterosubtypic co-infection,Journal of Virological Methods,0,China,"Heterosubtypic co-infection, Influenza A viruses, PCR, Protocol",2024
Pandemic influenza as a current threat,Current Topics in Microbiology and Immunology,111,"Hong Kong, United States",,2009
A fibrous flexible strain sensor with Ag nanoparticles and carbon nanotubes for synergetic high sensitivity and large response range,Composites Part A: Applied Science and Manufacturing,29,China,"A. Nanocomposites, A. Polymer-matrix composites (PMCs), A. Thermoplastic resin, B. Electrical properties, B. Microstructures",2023
"Systemic screening identifies GABRD, a subunit gene of GABAA receptor as a prognostic marker in adult IDH wild-type diffuse low-grade glioma",Biomedicine and Pharmacotherapy,21,China,"GABRD, IDH mutation, Low grade glioma, Prognosis",2019
"Three practical approaches for the synthesis of novel 4,7- dihetarylpyrazolo[1,5-a][1,3,5]triazines",Tetrahedron,17,"Colombia, Spain","5-Amino-1H-pyrazoles, O,S-Diethyl hetaroylimidothiocarbonates, Pyrazolo[1,5-a][1,3,5]triazines, Pyrazolylthioureas, S,S-Diethyl hetaroylimidodithiocarbonates",2012
Induction of protective immunity against influenza A/Jiangxi-Donghu/346/2013 (H10N8) in mice,Journal of General Virology,1,"Singapore, United States","A/Jiangxi-Donghu/346/2013, H10N8, PIKA, Vaccine",2017
Up-regulation of microRNA-203 in influenza A virus infection inhibits viral replication by targeting,Scientific Reports,39,China,,2018
"Influenza A virus infection dynamics in swine farms in Belgium, France, Italy and Spain, 2006-2008",Veterinary Microbiology,44,"Belgium, Spain, France, Italy, Netherlands","European Surveillance Network for Influenza in Pigs (ESNIP), Fattening pigs, Infection dynamics, Serological surveillance, Swine influenza",2013
"Novel high energy intermediate analogues with triazasterol-related structures as inhibitors of ergosterol biosynthesis: III. Synthesis and antifungal activity of N4-alkyl-1,6,7,11b-tetrahydro-2H-pyrimido[4,3-a]isoquinolin-4- amine salts",European Journal of Pharmaceutical Sciences,11,Austria,"4-Alkylaminotetrahydro-2H-pyrimido[4,3-a]isoquinoline salts, 8,13,15-Triazasteroids, Antifungal activity, High energy intermediate analogues, Structure-activity relationships, Synthesis and structure investigations",2003
"Development of novel pyrazole, imidazo[1,2-b]pyrazole, and pyrazolo[1,5-a]pyrimidine derivatives as a new class of COX-2 inhibitors with immunomodulatory potential",European Journal of Medicinal Chemistry,33,Egypt,"Anti-inflammatory activity, DFT calculation, Molecular docking studies, Pro-inflammatory cytokine, Pyrazole and pyrazolo[1,5-a]pyrimidine",2023
"Novel syntheses of pyrido[1,2-a]pyrimidin-2-ones, 2H-quinolizin-2-ones, pyrido[1,2-a]quinolin-3-ones, and thiazolo[3,2-a]pyrimidin-7-ones",Arkivoc,43,United States,"1,3-bis-electrophilic synthons, 2H-quinolizin-2-ones, Pyrido[1,2-a]pyrimidin-2-ones, Pyrido[1,2-a]quinolin-3-ones, Thiazolo[3,2-a]pyrimidin-7- ones",2004
"UVA photoirradiation of benzo[a]pyrene metabolites: Induction of cytotoxicity, reactive oxygen species, and lipid peroxidation",Toxicology and Industrial Health,25,"China, United States","Benzo[a]pyrene, lipid peroxidation, metabolite, Polycyclic aromatic hydrocarbons (PAHs), reactive oxygen species (ROS)",2015
"Resveratrol, a natural aryl hydrocarbon receptor antagonist, protects sperm from DNA damage and apoptosis caused by benzo(a)pyrene",Reproductive Toxicology,126,"Canada, France","Apoptosis, Benzo(a)pyrene AhR, BPDE, CYP1A1, DNA adducts, Mice, Spermatogenesis",2001
"Consequences of resistance: In vitro fitness, in vivo infectivity, and transmissibility of oseltamivir-resistant influenza A viruses",Influenza and other Respiratory Viruses,26,United States,"Animal model, Fitness, Influenza virus, Neuraminidase inhibitor, Oseltamivir, Transmissibility",2013
Evaluation of the zoonotic potential of multiple subgroups of clade 2.3.4.4 influenza A (H5N8) virus,Virology,9,,"Ferret, H5N8, HPAI, Mice, Pathogenesis",2018
A biosynthetic pathway to isovaleryl-CoA in myxobacterial: The involvement of the mevalonate pathway,ChemBioChem,33,"Germany, United States","Biosynthesis, Coenzyme A, Fatty acids, Myxobacteria, Natural products",2005
A small-molecule cell-based screen led to the identification of biphenylimidazoazines with highly potent and broad-spectrum anti-apicomplexan activity,European Journal of Medicinal Chemistry,21,France,"Anti-apicomplexan, Besnoitia besnoiti, Eimeria tenella, Imidazo[1,2-a]pyridine, Imidazo[1,2-b]pyridazine, Neospora caninum, Plasmodium falciparum, Toxoplasma gondii",2015
Protection against influenza A virus by vaccination with a recombinant fusion protein linking influenza M2e to human serum albumin (HSA),Journal of Virological Methods,10,"China, Japan","HSA, Immune protection, Influenza A virus, M2e, Vaccine",2016
"[Serological survey on antibodies to influenza A viruses subtype H1, H3, H5 and H9 of population in Shanghai].",Zhonghua liu xing bing xue za zhi = Zhonghua liuxingbingxue zazhi,3,China,,2009
"Synthesis and pharmacological activity N-aryloxyethyl derivatives of 9H-2,3-dihydroimidazo-and 10H-2,3,4,10-tetrahydropyrimido[1,2-a]benzimidazoles",Pharmaceutical Chemistry Journal,0,Russian Federation,,2006
Recovery of influenza A viruses from lake water and sediments by experimental inoculation,PLoS ONE,13,Germany,,2019
Topical application of human-derived Ig isotypes for the control of acute respiratory infection evaluated in a human CD89-expressing mouse model,Mucosal Immunology,8,"Australia, Switzerland",,2019
A short review on progress in perovskite solar cells,Materials Research Bulletin,67,India,"A. Efficiency, A. Hybrids, A. Perovskite solar cells, A. Stability, A. Structural evolution",2022
"Eco-epidemiological evidence of the transmission of avian and human influenza a viruses in wild pigs in Campeche, Mexico",Viruses,8,"Mexico, United States","A/H1N1, A/H5N2, Synanthropic, Wild pig, Zoonosis",2020
Preparing for a potential A(H7N9) pandemic: Lessons from the deployment of A(H1N1) pandemic vaccines,Expert Review of Vaccines,2,United Kingdom,"A(H1N1), A(H7N9), influenza, pandemic, pandemic influenza, preparedness, response, swine flu, vaccine",2013
Discovery of Multitarget-Directed Ligands Against Influenza A Virus From Compound Yizhihao Through a Predictive System for Compound-Protein Interactions,Frontiers in Cellular and Infection Microbiology,25,China,"biological process analysis, compound yizhihao, in vitro evaluation, influenza A virus, multitarget, virtual screening",2020
Locations and structures of influenza A virus packaging-associated signals and other functional elements via an in silico pipeline for predicting constrained features in RNA viruses,PLoS Computational Biology,0,United Kingdom,,2024
Evolution and Current Status of Influenza A Virus in Chile: A Review,Pathogens,7,"Canada, Chile","avian influenza virus, genomic surveillance, HPAI H5N1, influenza A virus, poultry farms, wild birds",2023
Conservation of T cell epitopes between seasonal influenza viruses and the novel influenza A H7N9 virus,Virologica Sinica,5,"China, Hong Kong, Mali","clinical phenotype, conservation, H7N9, immunity, influenza virus, T cell epitope, vaccine",2014
‘Proximity frequencies’ a new parameter to evaluate the profile of GABAAR modulators,Bioorganic and Medicinal Chemistry Letters,7,Italy,"4,5-Dihydropyrazolo[1,5-a]quinazoline, Electrophysiological assay, Linear Discriminant Analysis (LDA), Molecular Dynamic Simulation (MDS), Pyrazolo[1,5-a]quinazoline, Synthesis, α 1β2γ2-GABA<sub>A</sub>R modulators",2021
HBO1 is a versatile histone acyltransferase critical for promoter histone acylations,Nucleic Acids Research,40,China,,2021
"Optimization of a Screening Hit toward M2912, an Oral Tankyrase Inhibitor with Antitumor Activity in Colorectal Cancer Models",Journal of Medicinal Chemistry,7,Germany,,2021
A combination influenza mRNA vaccine candidate provided broad protection against diverse influenza virus challenge,Virology,0,"China, Mongolia","Immunoprotection, Influenza viruses, Influenza viruses mRNA vaccine, mRNA vaccine",2024
"Synthesis and Properties of Benzo[h]imidazo[1,2-a]quinolines and 1,2a-Diazadibenzo[cd,f]azulenes",Journal of Organic Chemistry,1,Germany,,2023
Knockdown of different influenza A virus subtypes in cell culture by a single antisense oligodeoxyribonucleotide,International Journal of Antimicrobial Agents,30,Russian Federation,"DNA fragments, Influenza A virus, Nanocomposite, TiO<sub>2</sub> nanoparticles",2015
Genetic and phylogenetic characterizations of a novel genotype of highly pathogenic avian influenza (HPAI) H5N8 viruses in 2016/2017 in South Korea,"Infection, Genetics and Evolution",24,,"HPAI H5N6 virus, HPAI H5N8 virus, Migratory birds, Reassortant, South Korea",2017
No detection of avian influenza A viruses of the subtypes H5 and H7 and isolation of lentogenic avian paramyxovirus serotype 1 in passerine birds during stopover in the year 2001 on the island Helgoland (North Sea),Deutsche Tierarztliche Wochenschrift,16,Germany,"AIV subtype H5 and H7, APMV-1, Epidemiology, Migrating passerines, Vectors, Zoonosis",2005
Seroprevalance and identification of influenza A virus infection from migratory wild waterfowl in China (2004-2005),Journal of Veterinary Medicine Series B: Infectious Diseases and Veterinary Public Health,22,China,,2006
In vitro combinations of baloxavir acid and other inhibitors against seasonal influenza a viruses,Viruses,22,"Canada, France","A(H1N1) virus, A(H3N2) virus, Baloxavir, Combination, Human airway epithelium, Influenza, Neuraminidase inhibitors, Polymerase inhibitors",2020
Characteristic amino acid changes of influenza A(H1N1)pdm09 virus PA protein enhance A(H7N9) viral polymerase activity,Virus Genes,8,China,"H7N9, Influenza A virus, Mutation, PA, Polymerase activity, Reassortment",2016
Chemistry of indolopyridines with a bridgehead heteroatom,Chemistry of Heterocyclic Compounds,2,Russian Federation,"Indolo[1,2-a]pyridines, Indolo[1,2-a]quinolines, Indolo[1,2-b]isoquinolines, Indolo[2,1-a]isoquinolines, Isoindolo[1,2-a]-isoquinolines, Isoindolo[2,1-a]pyridines, Isoindolo[2,1-a]quinolines, Isoindolo[2,1-b]isoquinolines",2001
"Molecular characterization of group A rotavirus (RVA) strains detected in bovine and porcine species: Circulation of unusual rotavirus strains. A study from western, India",Acta Virologica,5,India,"Animals, Genotypes, Rotaviruses, Unusual G-P types",2019
Substrate binding induces a cooperative conformational change in the 12S subunit of transcarboxylase: Raman crystallographic evidence,Biochemistry,11,United States,,2002
"KF-1607, a novel pan src kinase inhibitor, attenuates obstruction-induced tubulointerstitial fibrosis in mice",Biomolecules and Therapeutics,9,,"Chronic kidney disease, Renal fibrosis, Src kinase, Src kinase inhibitor, Ureteral obstruction",2021
"Conventional Medicinal Uses, Phytoconstituents, and Biological Activities of Euphorbia officinarum L.: A Systematic Review",Advances in Pharmacological and Pharmaceutical Sciences,8,Morocco,,2022
"Novel Benzo[a]phenoxazinium Chlorides Functionalized with Sulfonamide Groups as NIR Fluorescent Probes for Vacuole, Endoplasmic Reticulum, and Plasma Membrane Staining",International Journal of Molecular Sciences,1,Portugal,"benzo[a]phenoxazines, fluorescent probes, Nile Blue, NIR probes, sulfonamide groups",2023
"Heteroaromatic annulation of 2-methyl/2-cyanomethylbenzimidazole dianions with α-oxoketene dithioacetals: A highly regioselective synthetic protocol for 1,2-and 2,3-substituted/annulated pyrido[1,2-a]benzimidazoles",Journal of Organic Chemistry,59,India,,2003
Differential localization and function of PB1-F2 derived from different strains of influenza A virus,Journal of Virology,76,,,2010
Transcriptome Differences in Normal Human Bronchial Epithelial Cells in Response to Influenza A pdmH1N1 or H7N9 Virus Infection,Cells,1,,"Avian influenza A(H7N9) virus, Pandemic influenza H1N1 (pdmH1N1), Transcriptome",2022
5-Hydroxydecanoate is metabolised in mitochondria and creates a rate-limiting bottleneck for β-oxidation of fatty acids,Journal of Physiology,85,"Belgium, Germany, United States",,2005
Potential role of nonneutralizing IgA antibodies in cross-protective immunity against influenza a viruses of multiple hemagglutinin subtypes,Journal of Virology,25,"United Arab Emirates, Japan","Antibody, Broadly cross-reactive, Budding, Cross-protective immunity, Hemagglutinin, IgA, Influenza A virus, Nonneutralizing",2020
Broadly Reactive H2 Hemagglutinin Vaccines Elicit Cross- Reactive Antibodies in Ferrets Preimmune to Seasonal Influenza A Viruses,mSphere,11,"Georgia, United States","COBRA, ferrets, H2N2, influenza, pandemic, preimmunity",2021
Single-laboratory validation of a gas chromatography-mass spectrometry method for quantitation of 15 European priority polycyclic aromatic hydrocarbons in spiked smoke flavourings,Journal of Chromatography A,36,Belgium,"Gas chromatography-mass spectroscopy (GC-MS), Method validation, Polycyclic aromatic hydrocarbons (PAHs), Primary smoke condensate (PSC), Smoke flavours",2006
Molecular detection of a novel human influenza (H1N1) of pandemic potential by conventional and real-time quantitative RT-PCR assays,Clinical Chemistry,112,Hong Kong,,2009
Complete genome sequence of a novel reassortant H11N2 avian influenza virus isolated from a live poultry market in Eastern China,Journal of Virology,12,China,,2012
Iso-coenzyme A,Journal of Biological Chemistry,20,"Georgia, United States",,2005
Identification of a functional non-coding variant in the GABAA receptor α2 subunit of the C57BL/6J mouse reference genome: Major implications for neuroscience research,Frontiers in Genetics,39,United States,"BXD mice strains, C57BL/6J, CRISPR (clustered regularly interspaced short palindromic repeats)/Cas9, GABA-A receptor, GABRA2, Genetics, Inbred mouse strains, Neuroscience",2019
Surveillance for highly pathogenic influenza A viruses in California during 2014-2015 provides insights into viral evolutionary pathways and the spatiotemporal extent of viruses in the Pacific Americas Flyway,Emerging Microbes and Infections,16,United States,"California, clade 2.3.4.4, H5, highly pathogenic, influenza A, pinniped, virus, waterfowl",2017
"Synthesis of 1,2,3-Triazolylmethoxyphenyl[1,2,4]triazolo[1,2-a]in-dazoletrione Derivatives by Combining Click and Multicomponent Reactions",Synthesis (Germany),4,,"1,2,3-triazoles, click chemistry, melamine trisulfonic acid (MTSA), multicomponent reactions, urazoles",2016
"Discovery of highly potent proapoptotic antiestrogens in a series of androst-5,16-dienes D-modified with imidazole-annulated pendants",Journal of Steroid Biochemistry and Molecular Biology,6,"Belarus, Russian Federation","Anticancer activity, Antiestrogens, Imidazole-annulated heterocycles, Steroids",2023
A disintegrin-like and metalloprotease (reprolysin type) with thrombospondin type 1 motifs: The ADAMTS family,International Journal of Biochemistry and Cell Biology,224,United States,"A disintegrin and metalloprotease domain, A disintegrin-like and metalloprotease domain (reprolysin-type) with thrombospondin type 1 motifs, a.a., ADAM, ADAMTS, Amino acid, Matrix metalloprotease, Metalloprotease, MMP, Thrombospondin type 1 repeat, TSR",2004
"Efficient one-pot synthesis of new 1-amino substituted pyrrolo[1,2-a]quinoline-4-carboxylate esters via copper-free Sonogashira coupling reactions",Molecular Diversity,17,,"Copper-free, Palladium catalyst, Propargyl alcohol, Pyrrolo[1,2-a]quinoline, Sonogashira coupling",2017
Biochemical and structural characterization of an essential acyl coenzyme A carboxylase from Mycobacterium tuberculosis,Journal of Bacteriology,75,"Argentina, United States",,2006
"Tetrahydropyrazolo[1,5-a]pyridine-fused steroids and their in vitro biological evaluation in prostate cancer",European Journal of Medicinal Chemistry,19,"Canada, Portugal","Androgen, Galeterone, Prostate, pyrazolo[1,5-a]pyridine, Steroid",2019
"Synthesis of 5-alkyl(or aryl)pyrrolo[1,2-a]quinoxalin-4(5H)-ones by denitrocyclisation of N-alkyl(or aryl)-1-(2-nitrophenyl)-1H-pyrrole-2- carboxamides. Evidence of a Smiles rearrangement",Tetrahedron,24,Greece,"Defluorocyclisation, Denitrocyclisation, Pyrroles, Pyrroloquinoxalinones, Smiles rearrangement",2004
"Discovery of a Potent, selective and orally bioavailable CDK9 degrader for targeting transcription regulation in Triple-Negative breast cancer",Bioorganic Chemistry,0,China,"Cyclin-dependent Kinase 9, Orally bioavailable degrader, PROTAC, Targeting transcription regulation, Triple-negative breast cancer",2024
"Synthesis, characterization, antimicrobial activity and anticancer of some new pyrazolo[1,5-a]pyrimidines and pyrazolo[5,1-c]1,2,4-triazines",Medicinal Chemistry,22,Egypt,"5-a]pyrimidines, Anti-inflammatory, Antibacterial, Anticancer, Antimicrobial activity, Antioxidant, Pyra-zolo[5,1-c]1,2,4-triazines, Pyrazolo[1",2020
Gene expression profiles and genetic damage in benzo(a)pyrene diol epoxide-exposed TK6 cells,Mutation Research - Fundamental and Molecular Mechanisms of Mutagenesis,69,United States,"±anti-benzo(a)pyrene-trans-7,8- dihydrodiol-9,10-epoxide, 10α-(deoxyguanosin-N <sup>2</sup>-yl)-7α,8β,9β-trihydroxy-7,8,9,10-tetrahydrobenzo(a) pyrene, B(a)P, benzo(a)pyrene, BPDE, dG-N<sup>2</sup>-BPDE, HPRT, Thymidine Kinase, TK",2004
The PB1 gene from H9N2 avian influenza virus showed high compatibility and increased mutation rate after reassorting with a human H1N1 influenza virus,Virology Journal,3,"China, Netherlands","Avian influenza, H9N2, Human influenza, Mutation rate, NGS, Reassortment",2022
"Synthesis and Structure-Activity Relationships of 3,5-Disubstituted 4,5-Dihydro-6H-imidazo[1,5-a][1,4]benzodiazepin-6-ones at Diazepam-Sensitive and Diazepam-Insensitive Benzodiazepine Receptors",Journal of Medicinal Chemistry,39,United States,,1993
A-Kinase anchoring proteins that regulate cardiac remodeling,Journal of Cardiovascular Pharmacology,16,United States,"A-kinase anchoring protein (AKAP), cAMP protein kinase, cardiac remodeling, excitation-contraction coupling, heart failure, pathological hypertrophy, protein phosphatase, protein phosphorylation, sarcomeric regulation, signal transduction",2011
A quantitative structure-activity relationship study for structurally diverse HIV-1 protease inhibitors: Contribution of conformational flexibility to inhibitory activity,Journal of Enzyme Inhibition and Medicinal Chemistry,0,Japan,"Conformational flexibility, Distortion energy, HIV-1 protease inhibitor, Linear regression model",2006
Molecular cloning of mevalonate pathway genes from Taraxacum brevicorniculatum and functional characterisation of the key enzyme 3-hydroxy-3-methylglutaryl-coenzyme A reductase,Molecular Biology Reports,31,"Germany, France","3-hydroxy-3-methylglutaryl-coenzyme A reductase (HMGR), Mevalonate (MVA) pathway, Natural rubber, Taraxacum brevicorniculatum",2012
"Use of national pneumonia surveillance to describe influenza A(H7N9) virus epidemiology, China, 2004-2013",Emerging Infectious Diseases,64,"China, United States",,2013
Correlation between biomarkers of polycyclic aromatic hydrocarbon exposure and electrophilic tissue burden in a rat model,Archives of Toxicology,8,Canada,"1-Hydroxypyrene, 3-Hydroxybenzo(a)pyrene, Benzo(a)pyrene, Benzo(a)pyrene diolepoxide, Electrophilic tissue burden, Polycyclic aromatic hydrocarbon, Pyrene",2004
"Tissue distribution of DNA adducts in rats treated by intramammillary injection with dibenzo[a,l]pyrene, 7,12-dimethylbenz[a]anthracene and benzo[a]pyrene",Mutation Research - Fundamental and Molecular Mechanisms of Mutagenesis,32,United States,"7,12-Dimethylbenz[a]anthracene (DMBA), <sup>32</sup>P-postlabeling, Benzo[a]pyrene, Dibenzo[a]pyrene (DBP), DNA adduct",1997
"Lipoprotein(a) concentrations, apolipoprotein(a) isoforms and clinical endpoints in haemodialysis patients with type 2 diabetes mellitus: Results from the 4D Study",Nephrology Dialysis Transplantation,32,"Austria, Germany","all-causemortality, apolipoprotein(a) isoforms, cardiovascular disease, diabetes mellitus, infection, lipoprotein(a)",2016
"Comparison of neurotoxic potency between a novel chinbotulinumtoxinA with onabotulinumtoxinA, incobotulinumtoxinA and lanbotulinumtoxinA in rats","Drug Design, Development and Therapy",8,China,"A/Chin, A/Inco, A/Lan, A/Ona, Neurotoxic potency",2017
"The fading of Cassiopeia A, and improved models for the absolute spectrum of primary radio calibration sources",Monthly Notices of the Royal Astronomical Society,13,"Jordan, United States","Galaxies: individual: Cygnus A, Galaxies: individual: Virgo A, ISM: individual objects: Cassiopeia A, ISM: individual objects: Taurus A, Radio continuum: general",2017
Influenza vaccine effectiveness against influenza A in children based on the results of various rapid influenza tests in the 2018/19 season,PLoS ONE,7,Japan,,2021
Chemical modification of pradimicin A to suppress aggregation without impairing D-mannose-binding and antifungal activities,Tetrahedron,0,Japan,"Antibiotic, Antifungal activity, Carbohydrate recognition, Natural product",2022
"The tert-amino effect in the synthesis of hetaryl- and arylsulfonyl- substituted pyrrolo- and pyrido[1,2-a]quinoline derivatives and their pyrazolo annulated analogues",Synthesis,23,Ukraine,"Heterocycles, Pyrazolo[3,4-e]indolizines, Pyrazolo[4,3-c]quinolizines, Pyrrolo[1,2-a]quinolines, Ring closure",2005
