Title,Source title,Cited by,Authors Country,Author Keywords,Year
"Novel and selective TLR7 antagonists among the imidazo[1,2- a]pyrazines, Imidazo[1,5- a]quinoxalines, and Pyrazolo[1,5- a]quinoxalines Series",Journal of Medicinal Chemistry,37,"France, Lebanon",,2019
"Synthesis and Structure–Activity Relationships for the Anti-Mycobacterial Activity of 3-Phenyl-N-(Pyridin-2-ylmethyl)Pyrazolo[1,5-a]Pyrimidin-7-Amines",Pharmaceuticals,4,"New Zealand, United States","ATP synthase, pyrazolopyrimidines, structure–activity relationships, synthesis, tuberculosis",2022
"Synthesis of new derivatives of Alkylselanyl[1,2,4]triazolo[4,3-a]pyrimidine as selenium-containing heterocyclic system",Journal of Heterocyclic Chemistry,2,,,2023
"An efficient one-pot four-component synthesis of functionalized imidazo[1,2-a]pyridines",Helvetica Chimica Acta,12,,"Heterocycles, Heterocyclic ketene aminal (HKA), Imidazo[1,2-a]pyridines, Multicomponent reactions",2013
"Application of the Povarov Reaction in Biaryls under Iron Catalysis for the General Synthesis of Dibenzo[ a, c]Acridines",Journal of Organic Chemistry,19,India,,2020
"Design, synthesis and biological evaluation of novel 4- alkapolyenylpyrrolo[1,2-a]quinoxalines as antileishmanial agents - Part III",European Journal of Medicinal Chemistry,54,France,"Antileishmanial activity, Antimalarial activity, Antitrypanosomal activity, Pyrrolo[1,2-a]quinoxaline, Suzuki reaction, Synthesis",2014
Application of a fluorine strategy in the lead optimization of betulinic acid to the discovery of potent CD73 inhibitors,Steroids,3,China,"Betulinic acid, CD73 inhibitor, Drug design, Fluorine scanning",2022
"Synthesis of novel D-ring fused 7′-aryl-androstano[17,16-d][1,2,4] triazolo[1,5-a]pyrimidines",Steroids,41,China,"1,2,4-Triazolo[1,5-a]pyrimidine, 16-Arylidene-17-ketosteroids, 3-Amino-1,2,4- triazole, Heterosteroids, Steroidal[17,16-d]triazolopyrimidines",2012
"Synthesis and antitubercular evaluation of reduced lipophilic imidazo[1,2-a]pyridine-3-carboxamide derivatives",European Journal of Medicinal Chemistry,29,China,"Antitubercular agents, imidazo[1,2-a]pyridine carboxamides, Pharmacokinetics, structure−activity relationships",2019
Synthesis and topoisomerase I inhibitory properties of luotonin A analogues,Bioorganic and Medicinal Chemistry,71,United States,"Camptothecin, Luotonin A, Structure-activity relationships, Topoisomerase I-DNA inhibition",2004
Demonstration of the dynamic mass redistribution label-free technology as a useful cell-based pharmacological assay for endogenously expressed GABAA receptors,MedChemComm,7,Denmark,,2016
"Palladium-Catalyzed Double C-H Arylation Reaction: Tandem Synthesis of Benzo[ a ]imidazo[5,1,2- cd ]indolizines from Imidazo[1,2- a ]pyridines and o -Dihaloarenes",Synthesis (Germany),22,China,"arylation, C-H activation, indolizine-fused polycyclics, palladium, tandem synthesis",2015
"Synthesis and in-vitro anti-proliferative evaluation of some pyrazolo[1,5-a]pyrimidines as novel larotrectinib analogs",Bioorganic Chemistry,22,Egypt,"Anticancer activity, MDA-MB231 cell line, Pyrazolo[15-a]pyrimidine, Synthesis",2020
"3-Aryl-[1,2,4]triazino[4,3-a ]benzimidazol-4(10 H)-one: A novel template for the design of highly selective A2B adenosine receptor antagonists",Journal of Medicinal Chemistry,30,Italy,,2012
"A review of the ADAMTS family, pharmaceutical targets of the future",Current Pharmaceutical Design,67,"Belgium, United States","ADAMTS, Aggrecanase, Metalloproteinase",2009
A new focused microwave approach to the synthesis of amino-substituted pyrroloisoquinolines and pyrroloquinolines via a sequential multi-component coupling process,Synthesis,24,United Kingdom,"Focused microwave irradiation, Fused-ring systems, Heterocycles, Multi-component reactions, Pyrroloisoquinolines, Solid-supported reagents",2008
"Synthesis and antifungal activities of novel 5,6-dihydro-indolo[1,2-a] quinoxaline derivatives",European Journal of Medicinal Chemistry,103,China,"5,6-Dihydro-indolo[1,2-a]quinoxaline, Antifungal activity, Cyclization, Iron catalysis, Pictet-Spengler reaction",2011
"Metal free Lewis acid promoted one-pot synthesis of 14-aryl-14H dibenzo [a,j] xanthenes and their simple biological evolution",Tetrahedron Letters,15,India,"BTMA-Br<sub>3</sub>, Dibenzo [a,j] xanthenes, Metal free mild catalyst, Solvent-free & microwave condensation",2017
Semisynthetic Derivatives of Fradcarbazole A and Their Cytotoxicity against Acute Myeloid Leukemia Cell Lines,Journal of Natural Products,13,China,,2019
"Synthesis of novel 2-methylsulfanyl-4h-[1,2,4]triazolo[1,5-a]quinazolin-5- one and derivatives",Synthetic Communications,27,"Germany, Saudi Arabia","2-hydrazinobenzoic acid, Alkylation, chlorination, dimethyl-N-cyanoimidodithiocarbonate, thionation",2011
"Exploration of Pyrazolo[1,5-a]pyrimidines as Membrane-Bound Pyrophosphatase Inhibitors",ChemMedChem,5,"Finland, United Kingdom","antiprotozoal agents, drug discovery, inhibitor, membrane-bound pyrophosphatase, pyrazolo[1,5-a]pyrimidine",2021
"Synthesis of 2,3,4,11b-tetrahydro-1 H-pyridazino[6,1-a]isoquinolines via the three-component reaction of 2-alkynylbenzaldehydes, a sulfonohydrazide and dimethyl cyclopropane-1,1-dicarboxylate",Synthesis,14,China,"2-alkynylbenzaldehydes, dimethyl cyclopropane-1,1-dicarboxylate, nickel perchlorate hexahydrate, silver(I) triflate, sulfonohydrazide",2011
"Discovery of AZD4573, a Potent and Selective Inhibitor of CDK9 That Enables Short Duration of Target Engagement for the Treatment of Hematological Malignancies",Journal of Medicinal Chemistry,63,"China, United Kingdom, United States",,2020
"Diastereoselective synthesis of dihydroisoindolo[2,1-a]quinolin-11-ones by solvent-free AMCell-SO3H-catalyzed imino diels-alder/intramolecular amide cyclization cascade reactions",Journal of Organic Chemistry,27,Colombia,,2014
"Synthesis of 6H-isoindolo[2,1-a]indol-6-ones through a sequential copper-catalyzed C-N coupling and palladium-catalyzed C-H activation reaction",Tetrahedron,27,China,"Benzoyl chloride, C-H activation, Copper-catalysis, Coupling reaction, O-gem-Dibromovinyl aniline, Palladium-catalysis",2012
"In vitro identification of imidazo[1,2-a]pyrazine-based antileishmanial agents and evaluation of L. major casein kinase 1 inhibition",European Journal of Medicinal Chemistry,15,France,"Antileishmanial agents, Casein kinase 1, Homology model, Imidazo[1,2-a]pyrazines, L-CK1.2 inhibitors",2021
"Synthesis of heterocyclic compounds using amidines as their ene-1,1-diamine tautomers, iv: Synthesis of n-bridged heterocycles 1,2,3,4-tetrahydropyrido[1, 2-a]pyrimidin-6-ones and methyl 1,2,3,4-tetrahydropyrrolo- [1,2-a]pyrimidin-7- ylideneacetates",Synthetic Communications,2,Japan,"1,2,3,4-tetrahydropyrido[1,2-a]pyrimidin-6-one,methyl, 1,2,3,4-tetrahydropyrrolo[1,2-a]pyrimidin-7-ylideneacetate, A,b-unsaturated carbonyl compound, Cyclic ene-1,1-diamine, Dimethyl acetylenedicarboxylate, Ethyl benzoylacetate, N-bridged heterocycles",2011
A Novel Mitragynine Analog with Low-Efficacy Mu Opioid Receptor Agonism Displays Antinociception with Attenuated Adverse Effects,Journal of Medicinal Chemistry,36,United States,,2021
"Synthesis and in-vitro inotropic evaluation of 2-(4-substitutedbenzyl-1,4- diazepan-1-yl)-N-(4,5-dihydro-1-phenyl-[1,2,4]triazolo[4,3-a]quinolin-7-yl) acetamides",Archiv der Pharmazie,5,China,"1,4-Diazepane, [1,2,4]Triazolo[4,3-a]quinolines, Positive inotropic activity, Stroke volume",2010
Anticancer properties of indole derivatives as IsoCombretastatin A-4 analogues,European Journal of Medicinal Chemistry,26,"Spain, France","Cancer, Cytotoxicity, Indole, isoCA-4, Oxazinoindole, Pyridoindole, Quinazoline, Tubulin",2021
"An Efficient Ugi-Azide Four-Component Approach for the Preparation of Novel 1-(1H-tetrazol-5-yl)-10-chloro-1,2,3,4-tetrahydropyrazino[1,2-a] Indoles",Journal of Heterocyclic Chemistry,7,,,2019
Stereoselective synthesis of indenone-fused heterocyclic compounds via a one-pot four-component reaction,Tetrahedron,26,,"1,1-bis(methylthio)-2-nitroethene, 1,3-indandione, Aromatic aldehydes, Diamines, Multi-component synthesis",2017
"Synthesis of new antimicrobial pyrrolo[2,1-a]isoquinolin-3-ones",Bioorganic and Medicinal Chemistry,41,Spain,"Bactericide, Bischler-Napieralski cyclodehydration, Fungicide, Pyrrolo[2,1-a]isoquinolin-3-ones",2012
"Combining Amines and 3-(2-Pyridyl)-[1,2,3]Triazolo[1,5- a ]pyridine: An Easy Access to New Functional Polynitrogenated Ligands",Synthesis (Germany),1,Spain,"copper catalysis, heterocycles, nitrogenated ligands, triazolopyridines",2019
"Pyrido[1,2-a]benzimidazole-Based Agents Active Against Tuberculosis (TB), Multidrug-Resistant (MDR) TB and Extensively Drug-Resistant (XDR) TB",ChemMedChem,54,"United States, South Africa","Benzimidazole derivatives, Drug design, Drug discovery, Drug resistance, Tuberculosis",2011
"Synthesis and characterization of some novel 2-(trifluoromethyl)pyrimido- [1,2-a]benzimidazoles and pyrimido[1,2-a]benzimidazol-2H-ones of biological interest",Synthesis,54,Brazil,"2-aminobenzimidazole, DNA-topoisomerase I inhibitory activity, Enones, Halogenated heterocycles, Pyrimidobenzimidazole",2006
Development of a Covalent Inhibitor of c-Jun N-Terminal Protein Kinase (JNK) 2/3 with Selectivity over JNK1,Journal of Medicinal Chemistry,10,"China, United States",,2023
"1,8-Naphthyridines VI. Synthesis and anti-inflammatory activity of 5-(alkylamino)-N,N-diethyl[1,2,4]triazolo[4,3-a][1,8]naphthyridine-6-carboxamides with a new substitution pattern on the triazole ring",European Journal of Medicinal Chemistry,33,Italy,"Anti-inflammatory activity, [1,2,4]Triazolo[4,3-a][1,8]naphthyridine-6-carboxamide derivatives",2008
"Synthesis, molecular docking and anti-mycobacterial evaluation of new imidazo[1,2-a]pyridine-2-carboxamide derivatives",European Journal of Medicinal Chemistry,30,India,"Anti-mycobacterial activity, Imidazopyridine amide, InhA, Tuberculosis, X-ray crystallography",2015
"Synthesis of 3-(2-chloroethyl)-2-methyl-6,7,8,9-tetrahydro-4H-pyrido[1,2-a] pyrimidin-4-one derivatives as antibacterial agents",Medicinal Chemistry,1,India,"2-aminopyridine, Antibacterial activity, Aromatic amines, Phosphorousoxychloride, Reduction, Strepyomycin",2013
"Exploration of novel TOSMIC tethered imidazo[1,2-a]pyridine compounds for the development of potential antifungal drug candidate",Drug Development Research,8,India,"ADME, antifungal, antioxidant, fluorescence, imidazo[1,2-a]pyridine, multicomponent reaction",2022
"CuI-catalyzed synthesis of (benzo)imidazo[2,1-a]isoquinolinone derivatives via successive α-arylation, deacylation and benzyl automatic oxidation",Tetrahedron,3,China,"Benzylic oxidation, CuI, Deacylation, Imidazoisoquinolinone, α-Arylation",2020
"Biological evaluation of halogenated thiazolo[3,2-a]pyrimidin-3-one carboxylic acid derivatives targeting the YycG histidine kinase",European Journal of Medicinal Chemistry,41,China,"Antibacterial activity, Antibiofilm activity, Halogenated thiazolo[3,2-a]pyrimidin-3-one, Staphylococcus aureus, Staphylococcus epidermidis, YycG histidine kinase inhibitor",2014
"Novel biologically active nitro and amino substituted benzimidazo [1,2-a]quinolines",Bioorganic and Medicinal Chemistry,43,Croatia,"Antiproliferative activity, Benzimidazoles, Benzimidazo[1,2-a]quinolines, Cytometry analysis, Interaction with ct-DNA",2011
Host range of influenza a virus H1 to H16 in Eurasian ducks based on tissue and receptor binding studies,Journal of Virology,22,"Denmark, Netherlands, Sweden","Avian influenza, Avian influenza, Chicken, Glycan, Hemagglutinin, Sialic acid receptor, Virus attachment, Wild birds",2021
"Efficient synthesis and In Silico study of some novel pyrido[2,3-d][1,2,4]triazolo[4,3-a]pyrimidine derivatives",Journal of Heterocyclic Chemistry,16,"Germany, Egypt, Saudi Arabia",,2020
"Design, synthesis and structure-activity relationship studies of 3-phenylpyrazino[1,2-a]indol-1(2H)-ones as amyloid aggregation and cholinesterase inhibitors with antioxidant activity",European Journal of Medicinal Chemistry Reports,5,Canada,"Alzheimer's disease, Amyloid-beta, Antioxidants, Blood brain barrier, Cell death, Cholinesterase, Multi-target-directed-ligands, Phenylpyrazino[1,2-a]indol-1(2H)-one, Structure-activity relationship studies",2022
"Synthesis of potential anticancer derivatives of pyrido[1,2-a] benzimidazoles",Medicinal Chemistry Research,23,Egypt,"1-chloro-4-cyanopyrido[1,2-a] benzimidazoles, 4-cyano-1-(4-(2-fluorophenyl)piperazin-yl)-3-methylpyrido[1,2-a] benzimidazoles, 4-cyano-1-oxo-pyrido[1,2-a]benzimidazoles, Anticancer",2012
"Synthesis, in vitro antiplatelet activity and molecular modelling studies of 10-substituted 2-(1-piperazinyl)pyrimido[1,2-a]benzimidazol-4(10H)-ones",European Journal of Medicinal Chemistry,23,Italy,"10-Substituted 2-(1-piperazinyl)pyrimido[1,2-a]benzimidazol-4(10H)-ones, Antiplatelet activity, Molecular modelling study, Synthesis",2013
"Novel [1,2,3]triazolo[1,5-a]pyridine derivatives are trypanocidal by sterol biosynthesis pathway alteration",Future Medicinal Chemistry,7,"Chile, Spain","14α-demethylase, cell cycle arrest, mass spectrometry, squalene/cholesterol-ergosterol balance, triazolopyridine derivatives",2019
"New 1,2,3-triazolo[1,5-a]quinoxalines: Synthesis and binding to benzodiazepine and adenosine receptors. II",European Journal of Medicinal Chemistry,65,Italy,"1,2,3-triazolo[1,5-a]quinoxalines, Adenosine receptor binding, Benzodiazepine receptor binding",2002
"Cytotoxicity of New 5-Hydrazono-[1,2,4]triazolo[1,5-a]quinazolines (Part II)",Latin American Journal of Pharmacy,13,"Egypt, Saudi Arabia","5-Hydrazono-[1,2,4]triazolo[1,5-a]quinazoline, Cytotoxicity, HeLa, Hep-G2, L929, MCF-7",2016
"Derivatives of a new heterocyclic system-pyrano[3,4-: C] [1,2,4]triazolo[4,3- a] pyridines: Synthesis, docking analysis and neurotropic activity",MedChemComm,12,"Armenia, Greece",,2019
"Development of an Industrial Process Based on the Groebke-Blackburn-Bienaymé Multicomponent Reaction: Efficient Preparation­ of 3-Aminoimidazo[1,2-a]pyrazines",Synthesis (Germany),16,Switzerland,"cyclisation, Groebke-Blackburn-Bienaymé reaction, multicomponent reaction, one-pot process, sulfate salt",2017
The GABA a receptor subunits heterologously expressed in Xenopus oocytes,Mini-Reviews in Medicinal Chemistry,6,Malaysia,"CDNA, cRNA, GABA a receptor, Subunits, Two-electrode voltage clamp, Xenopus laevis oocytes",2013
"Multicomponent Synthesis of 1,3-Diketone-Linked N-Substituted Pyrroles, Pyrrolo[1,2- a]pyrazines, Pyrrolo[1,4]diazepines, and Pyrrolo[1,4]diazocines",Journal of Organic Chemistry,24,,,2019
"Synthesis and biological evaluation of pyrazolo[1,5-a]pyrimidine-3-carboxamide as antimicrobial agents",Medicinal Chemistry Research,62,"Egypt, France","5-Aminopyrazole, Antimicrobial agents, Pyrazolo[1,5-a]pyrimidine, X-ray crystallography",2017
"Stereocontrolled construction of 4,5-dihydropyrrolo[1,2-a]quinoxaline scaffolds via chiral phosphoramidate catalyzed Pictet-Spengler-type reaction",Tetrahedron Asymmetry,17,China,,2016
"Synthesis of new 1-phenylthieno[1,2,4]triazolo[4,3-a]pyrimidin-5(4H)-one derivatives",Journal of Heterocyclic Chemistry,15,,,2011
"General C-H Arylation Strategy for the Synthesis of Tunable Visible Light-Emitting Benzo[a]imidazo[2,1,5-c,d]indolizine Fluorophores",Journal of Organic Chemistry,31,Canada,,2017
"Synthesis of Functionalized Pyrazolo[1,5-a]pyridines: [3+2] Cycloaddition of N-Aminopyridines and α,β-Unsaturated Carbonyl Compounds/Alkenes at Room Temperature",Synthesis (Germany),28,India,"chalcones, drug intermediates, metal-free, N-methylpyrrolidone, [3+2] cycloaddition",2017
Long noncoding RNA #61 exerts a broad anti-influenza a virus effect by its long arm rings,Antiviral Research,1,China,"Broad antiviral strategy, Influenza A virus, LNP, Long noncoding RNA, Mice",2023
Synthesis and antitumor activities of a series of novel quinoxalinhydrazides,Bioorganic and Medicinal Chemistry,115,"Italy, United States",,2007
"Exploring the isoform selectivity of TGX-221 related pyrido[1,2-a]pyrimidinone-based Class IA PI 3-kinase inhibitors: Synthesis, biological evaluation and molecular modelling",Bioorganic and Medicinal Chemistry,13,New Zealand,"Comparative modelling, Docking, p110β, Phosphatidylinositol 3-kinase, PI3K, TGX-221",2015
"Synthesis and anti-microbial activity of novel series of N-(substituted phenyl- 1H-tetrazol-1-yl)-7-substituted tetrazolo [1,5-a]quinoxalin-4yl-amine derivatives",Der Pharma Chemica,2,India,"Anti-microbial activity, Sodium azide, Substituted 4-hydrazinyl tetrazolo[1,5-a]-quinoxaline, Substituted aromatic aldehydes",2016
Virus-neutralizing antibody response of mice to consecutive infection with human and avian influenza A viruses,Acta Virologica,1,Slovakia,"Antibody response, Avian influenza A viruses, HA2-specific antibodies, Original antigenic sin, Sequential influenza a infection, Virus-neutralizing antibodies",2015
"Synthesis of 9H-Pyrrolo[1,2-a]indole and 3H-Pyrrolizine Derivatives via a Phosphine-Catalyzed Umpolung Addition/Intramolecular Wittig Reaction",Journal of Organic Chemistry,66,France,,2016
"Synthesis of new hexahydropyrimido[1,2-a]azepine derivatives bearing functionalized aryl and heterocyclic moieties as anti-inflammatory agents",Future Medicinal Chemistry,2,Egypt,"anti-inflammatory, PGE2, pyrimidoazepine, selective COX-2 inhibition",2021
"Sequential Photo-oxidative [3 + 2] Cycloaddition/Oxidative Aromatization Reactions for the Synthesis of Pyrrolo[2,1-a]isoquinolines Using Molecular Oxygen as the Terminal Oxidant",Journal of Organic Chemistry,80,Japan,,2016
Functional and structural properties of mammalian acyl-coenzyme A thioesterases,Progress in Lipid Research,125,Australia,"β-Oxidation, Acyl-coenzyme A hydrolase, Acyl-coenzyme A thioesterase, Arachidonoyl-CoA, Fatty acid metabolism, Hotdog fold",2010
"Synthesis and anti-inflammatory activity evaluation of novel 7-alkoxy-1-amino-4,5-dihydro[1,2,4]triazole[4,3-a]quinolines",Archiv der Pharmazie,29,China,"1,2,4-Triazole, Anti-inflammatory, Quinoline",2008
"New bis([1,2,4]triazolo)[4,3-a:3′,4′-c]quinoxaline derivatives as VEGFR-2 inhibitors and apoptosis inducers: Design, synthesis, in silico studies, and anticancer evaluation",Bioorganic Chemistry,72,"Egypt, Saudi Arabia","Anti-proliferative, Apoptosis, Bis([1,2,4]triazolo)[4,3-a:3′,4′-c]quinoxaline, Docking studies, VEGFR-2 inhibitors",2021
"New one-step synthesis of pyrazolo[1,5-a]pyrimidine and pyrazolo[1,5-a]quinazoline derivatives via multicomponent reactions",Journal of Heterocyclic Chemistry,21,India,,2009
"Recent Developments in the Synthesis of Imidazo[1,2- a ]pyridines",Synthesis (Germany),222,India,"2-aminopyridine, C-H activation, imidazo[1,2- a ]pyridine, multicomponent reaction, tandem reaction",2015
"Intermolecular reductive cyclodimerization of cyclic α,β- unsaturated ketones promoted by a low-valent titanium reagent: A facile synthesis of some new spiro compounds",Synthesis,3,China,"Cyclic α,β-unsaturated ketones, Low-valent titanium, Spiro compounds, Stereochemistry",2007
"Design, synthesis, in vitro cytotoxic activity evaluation, and study of apoptosis inducing effect of new styrylimidazo[1,2-a]pyridines as potent anti-breast cancer agents",Anti-Cancer Agents in Medicinal Chemistry,7,,"anti-breast cancer, Anti-cancer, Apoptosis, Cytotoxicity, Styrylimidazo[1,2-a]pyridines, TUNEL assay",2019
"Synthesis, antitumor activity, pharmacophore modeling and qsar studies of novel pyrazoles and pyrazolo [1, 5-A] pyrimidines against breast adenocarcinoma MCF-7 cell line",International Journal of Pharmacy and Pharmaceutical Sciences,11,Egypt,"1 QSAR study, 3D pharmacophore, Cell cycle profile, MCF-7 breast cancer cell line, Pyrazole, Pyrazolo[1,5-a]pyrimidine",2016
"Synthesis of 2,3,4,5-tetrahydro-1H-pyrrolo[1,2-a][1,4]diazepines and 11-methyl-2,3,4,5-tetrahydro-1H-[1,4]diazepino[1,2-a]indoles",Arkivoc,4,United States,"Benzotriazole, Pyrrolodiazepines, Tetrahydro[1,4]diazepino[1,2-a]indoles",2003
"New synthetic approach to substituted isoindolo[2,1-a]quinoline carboxylic acids via intramolecular Diels-Alder reaction of 4-(N-furyl-2)-4- arylaminobutenes-1 with maleic anhydride",Tetrahedron,38,Russian Federation,"3-Aza-10-oxatricyclo[5. 2.1.0<sup>1,5</sup>]decenes, Homoallylamines (4-(furyl-2)-4-N-arylaminobut-1-enes), Intramolecular Friedel-Crafts alkylation, Intramolecular furan Diels-Alder reaction (IMDAF), Isoindolo[2,1-a]quinolines",2005
Construction and immunogenicity evaluation of recombinant influenza A viruses containing chimeric hemagglutinin genes derived from genetically divergent influenza A H1N1 subtype viruses,PLoS ONE,8,United States,,2015
Screening a protein kinase inhibitor library against Plasmodium falciparum,Malaria Journal,14,"Switzerland, United Kingdom",,2017
"Synthesis, characterization and cytotoxicity evaluation of 5-Hydrazono-[1,2,4]triazolo[1,5-a]quinazolines (Part I)",Latin American Journal of Pharmacy,13,"Egypt, Saudi Arabia","5-hydrazono-[1,2,4]triazoloquinazoline, Cytotoxicity, Hela, Hep-G2, L929, MCF-7",2016
"Traditional uses, phytochemistry, and pharmacology of Ailanthus altissima (Mill.) Swingle bark: A comprehensive review",Journal of Ethnopharmacology,29,China,"Ailanthus altissima, Botany, Pharmacology, Phytochemistry, Traditional uses",2021
Variation in the HA antigenicity of A(H1N1)pdm09-related swine influenza viruses,Journal of General Virology,4,"Egypt, Japan","Antigenicity, Hemagglutinin, Influenza, Pmd09, Swine",2021
"Stereoselective Synthesis of 12-Tetrazolyl Substituted (E)-5H-Quinazolino[3,2-a]quinazolines via Sequential Ugi-Azide/Staudinger/aza-Wittig/Addition/Ag(I)-Catalyzed Cyclization",Journal of Organic Chemistry,11,China,,2023
"Au(I)-Catalyzed Access to 1 H-Pyrrolo[1,2- a]indol-2(3- H)-ones via Oxidation of Terminal Alkynes",Journal of Organic Chemistry,13,China,,2018
"Synthesis and anti-tumor activities of novel pyrazolo[1,5-a]pyrimidines",Archiv der Pharmazie,76,China,"Anti-tumor activities, Pyrazolo[1,5-a]pyrimidines, Synthesis",2006
"Synthesis and rearrangement of cycloalkyl[1,2-e]oxazolo[3,2-a]pyrimidin-8/ 9-ones: An access to cycloalkyl[1,2-d]oxazolo[3,2-a]pyrimidin-5-ones",Tetrahedron,6,France,"DSC analysis, Intramolecular rearrangement, Oxazolo[3,2-a]pyrimidinone, X-ray crystallography",2005
"Roles of antibodies to influenza A virus hemagglutinin, neuraminidase, and M2e in conferring cross protection",Biochemical and Biophysical Research Communications,17,"Georgia, United States","Influenza virus, M2e, Neuraminidase, Split vaccines",2017
"Novel 1,2,4-Triazolo[1,5- a ]pyridines and their fused ring systems attenuate oxidative stress and prolong lifespan of caenorhabiditis elegans",Journal of Medicinal Chemistry,82,"Egypt, Saudi Arabia, Sudan",,2012
"A comprehensive review on ethnomedicinal, phytochemical and pharmacological properties of genus Bistorta (L.) scop.",Fitoterapia,0,India,"Biological activities, Bistorta, Ethnobotany, Kashmir Himalaya, Pharmacology, Phytochemicals",2024
"Microwave assisted one-pot synthetic route to imidazo[1,2-: A] pyrimidine derivatives of imidazo/triazole clubbed pyrazole and their pharmacological screening",New Journal of Chemistry,43,India,,2018
"2-Substituted 5,6-dimethyl-3-phenylsulfonyl-pyrazolo[1,5-a]pyrimidines: New series of highly potent and specific serotonin 5-HT6 receptor antagonists",European Journal of Medicinal Chemistry,38,"Russian Federation, United States","5-HT<sub>6</sub> receptor antagonist, Phenylsulfonyl, Pyrazolopyrimidine, SAR",2011
Inhibition by norharman of metabolism of benzo[a]pyrene by the microsomal mixed function oxidase of rat liver,Chemico-Biological Interactions,22,Japan,"1,6-quinone, benzo[a]pyrene-1,6-dione, 3,6-quinone, benzo[a]pyrene-3,6-dione, 3-hydroxybenzo[a]pyrene, 3-OH-BP, 4,5-diol, 4,5-dihydro-4,5-dihydroxybenzo[a]pyrene, 6,12-quinone, benzo[a]pyrene-6,12-dione, 7,8-diol, 7,8-dihydro-7,8-dihydroxybenzo[a]pyrene, 9,10-diol, 9,10-dihydro-9,10-dihydroxybenzo[a]pyrene, 9-hydroxybenzo[a]pyrene, 9-OH-BP, benzo[a]pyrene, BP, high-pressure liquid chromatography, HPLC",1980
"Hyperconjugation effect on diene reactivity in 1-methyltetrazolo[5,1-a]isoindole-derived amides and thioamides",Tetrahedron,6,Ukraine,"Amides, Diels–Alder reaction, Diene reactivity, Isoindoles, n→σ* hyperconjugation, Thioamides",2019
Differential modulation of innate immune responses in human primary cells by influenza a viruses carrying human or avian nonstructural protein 1,Journal of Virology,15,"Austria, United States","Dendritic cells, Epithelial cells, Influenza, Innate immunity, Interferons, NS1 protein",2020
Establishment of a novel cell-based assay using HLA-transfected cells to detect HLA antibodies,Journal of Immunological Methods,0,Japan,"HLA antibody, HNA, HPA, ICFA, Single antigen",2021
"Syntheses of 3-(2-Nitrovinyl)-indoles, Benzo[a]carbazoles, Naphtho[2,1-a]carbazoles, and 1-Hydroxy-β-carbolines Lead to Identification of Antiproliferative Compounds Active under Hypoxia",Journal of Organic Chemistry,0,"Russian Federation, United States",,2024
"Synthesis of new 6-halogeno-imidazo[1,2-a]pyridines by SRN1reactions",Arkivoc,14,France,"Imidazo[1,2-a]pyridine, Nitroheterocycles, Reductive alkylating agent, S <sub>RN</sub>1",2003
"Thiazolo[3,2-a] Pyrimidones as a Novel Anti-TB Agents",Journal of Heterocyclic Chemistry,2,India,,2018
"Synthesis and Antiproliferative Evaluation of New Pyrimido[1,6-a]Thieno[2,3-d]Pyrimidine Derivatives",Journal of Heterocyclic Chemistry,3,,,2017
A Metal-Free Synthesis of 3-Phenoxyimidazo Heterocycles by Catalytic Oxidative Cyclization of 2-Amino-azaarenes with Lignin Models,Synthesis (Germany),11,China,"2-phenoxyacetophenone, benzo[ d ]imidazo[2,1- b ]thiazole, imidazo[1,2- a ]pyridine, lignin model, metal-free, oxidative cyclization",2018
